,0
0,"요새 아이디어가 고갈되고, 또 생성되고, 또 사라졌다가, 또 불쑥 튀어나오네요. 좋은 아이데이션 과정에 대한 답 또한 관심이 많습니다. 오늘은 ‘아이디어를 위한’ 방향성을 가지고 이야기를... "
1,영어놀이 아이디어 고갈... 결국 카드찾기 드디어 아이디어 고갈입니다. 이게... 뭔가 하려고 하면.. 머리속에서 아무런 생각이 안날때가 종종 있습니다. 물론 멋진 아이디어가 팡팡팡 떠오를때도 있긴 해요... 
2,다들 뭐해먹고 사나요? 매일매일 눈떠서 잠들때까지 젤 많이하는 생각이 '오늘 뭐먹지?' ㅋㅋㅋㅋㅋ 남편이랑 애랑 어떤메뉴를 줘야하나 늘 고민의 연속 ! 결국 매일 비슷비슷하게 흘러가지만?ㅋㅋ 냉장고 싸악... 
3,"그러므로 브랜드, 하드웨어, 애플리케이션, 직원 모두 서로 얽힌 전체의 일부가 되어야 한다.  아이디어가 고갈된 디자이너를 위한 책 : 로고 디자인 편 저자 스티븐 헬러,게일 앤더슨 출판 더숲 발매 ..."
4,지금 머리하러 왔는데 시간이 너무 안 가서 블챌 올리기  토 교직실무 과제로 문제 개 만드는데 시간은 걸린 듯 물론 그 중에 집중한 시간은 도 안된다 문제 푸는 것보다 만드는 게 체감상 배는 힘들다... 
5,"그래서 이번 휴일동안에는 나름 고갈된 머릿속을 채우기 위해 열심히 인풋을 했다. '뭐라도 머리에 들어가야 또 나오지 않겠나' 하는 마음으로 말이다. © possessedphotography, 출처 Unsplash '포스팅을 안 하더라도... "
6,대기업의 상술이다 뭐다 해도 간만에 빼빼로 먹는 분들도 있을 거고 아니면 연인에게 이번엔 어떤 빼빼로 포장을 해야 할지 고민하시는 분들도 많을 것 같은데 이런 아이디어 고갈 시점에 딱 맞춰 체험하게 된... 
7,( 애들 간식 아이디어 고갈이에요. 다들 뭐 맥이면서 키우시나요 ㅜㅜ) * 우리 애들 먹거리 루틴 * [ (아침 + 오전 간식)  (점심 + 오후 간식)  (저녁 + 저녁 간식) ] 각 끼니 사이에 우유 한 팩씩 먹이고요. 그런데도... 
8,나는요 완전히 고갈됐어요 열심히 산 일주일이었는데 너무 열심히 산 나머지 사진 찍을 만한 활동을 한 게 없어 먹은 음식 사진이나 많이 첨부합니다 월수의 포식 화요일엔 바로 전 글처럼 적벽 차를 뛰러... 
9,"세 달동안 하고싶은 거 다 해먹었더니 이제 더이상 아이디어가 없어요... 한 끼는 간식처럼 때우고, 저녁에는 돼지갈비를 해먹었습니다. 잡내제거를 더 잘했어야 했는데. 아니, 갈비찜 양념에 목살을 넣었어야... "
10,"나의 생각, 너의 기억 - 규현 드디어.. 밀리고 밀린 정상적인 일상글을 쓸 수 있게 되었습니다.. ⛳️  ~  입실렌티 다음 날에 엠티 가는 과가 있다..? 심지어 선발대라서 시까지 봉화산까지 갔는데 알고보니... "
11,"[유튜브 꿀팁] 유튜브 콘텐츠 아이디어 고갈 시, 권장 드리는 방법 하나 소개해드립니다! 영상 콘텐츠도 찍고 돈도 벌 수 있어요! (광고 아닙니다) 유튜브 브랜디드 광고라든지 협찬이나 체험단을 제외하고... "
12,"아이디어가 고갈된 디자이너를 위한 책 : 로고 디자인 편 저자 스티븐 헬러, 게일 앤더슨 출판 더숲 발매 ... #그래픽디자인 #로고디자인 #브랜딩  로고는 (물건을) 판매하지 않는다. (물건을)... "
13,"책에는 배울 수 있는 것들이 많다 보니 ㅎㅎ~ 그럼 '아이디어가 고갈된 디자이너를 위한 책'에 대한 간략한 리뷰를 써볼게요~ 다양한, 기업들의 로고 역사의 원천을 배울 수 있는 책입니다. 어떤 식으로... "
14,"이번주 분량 조절 좀 실패 ㅋㅋ 근데 얘들아 블챌 서이웃으로 올리면 참여 안되냥? 사람 아무도 없는 버스? 너무 좋아~ 좋아하는 노래 들으면서 창밖보면 감성 폭, 발 주영 선생님의 조언으로 중스회를 잡기 위해... "
15,거의 남발 급으로 갔더니 결국 떨어졌습니다(....)익산행 무궁화호 #(전기기관차 호)오늘의 철도계 부수차량들(컨텐츠 고갈이 와버렸다)행신행 KTX-산천 #(호기 편성)여수행 무궁화호 #... 
16,"크림색 얘는 목부분이 도톰하고 어깨가 쫍아요 얘는 단추가 있어요. 안보이지만, 앞은 얇고 뒤는 도톰한 언발란스한게 뽀인뜨에요. 센스 세일 구경하다 찾은 브랜드인데 모델핏이 참 예뿌넴. 처음 들어보는데... "
17, (화) 오늘 진짜 이상한 꿈을 꾸고 일어나서 엥??했는데 그게 무엇이었냐면.....제가 애를 낳는 꿈이었습니다.... 임신 및 출산과정은 없고 그냥 어느 순간 내 손에 애가 들려있었는데 나도 당연하게 내 애라고... 
18,네가 뭘 좀 아는구나 블챌 덕에 공주들이 열심히 블로그를 올려 즐거운데요 말이 많을 수록 재미 배 진지해서 재미없을 수록 재미 배 더욱 말 많아 귀여운 너희들 되어주렴 ^.^ 두번째 여정 가보자고요 더... 
19,안녕 저는 뭉. 벌써 시 분이에요. 저는 빨리 블로그를 쓰고 내일 보는 영어 쪽지시험 준비해야하니깐 빨리 가볼게요 레츠 고 일. 아빠 생일이었어요. 그래서 케이크먹고 술도 한잔 마심. 히히 요즘 애들은... 
20,"아이디어가 고갈된 디자이너를 위한 책: 그래픽 디자인 편 저자 스티븐 헬러,게일 앤더슨 출판 더숲 발매 ... 세계적인 거장 인이 만든, 디자인 역사에서 손꼽히는 훌륭한 작품과 아이디어를 한 권에... "
21,동훈이가 우리 음료사주고 감 개꿀띠 뒤에 넣어두고 야금야금 먹었음 야무지게 리필까지 해먹었즤 팟타이 해먹음 고수 첨먹어보는데.. 싫진 않은데 좋지도 않음 술먹고 환승연애보면서 우는 사람 그게 바로... 
22,"일도 아직인데, 아이디어가 고갈되었습니다 아이디어 고갈 창작 이야기를 계속 쓰려다가 괜히 현타가 오기도 했고, 좀 부끄럽더라고요. 그리고 무엇이 있었을까, 어떤 이야기를 전하고 싶었을까, 고민했지만... "
23,친구의 유혹으로 아주 멋진 전시회에 다녀올 기회가 생겼었다 감상이라는 일은 아주 지루하고 지루하고 지루하다 생각했지만 그냥 깊게 생각할 여유가 없었던 탓에 그렇게 생각하고 싶었던 것도 같다. 사실... 
24,"ㅡㅡㅡㅡㅡㅡ 요즘 tv 미디어, 대기업들은 아이디어가 고갈되었고 썩어빠졌다. 영상과 상품들이 전부~ 유튜브, 인스타, 트위터에서 본것들이다. ㅡㅡㅡㅡㅡㅡㅡㅡ 개인꺼 그대로~ 배껴쓰는~ 요즘 ~~~~ 영상과... "
25,"#일러스트레이터 #독서 #책추천 아이디어가 고갈된 디자이너를 위한 책 저자 스티븐 헬러, 게일 앤더슨 출판 더숲 발매 ... 여러 기법과 방식으로 만들어진 작품을 하나씩 소개하며 짤막하게 읽을 수 있다... "
26,저번주는 행사가 있어서 너무 힘들었다 월요일까지 일 근무했는데 일동안 마감이었다 너무 힘들어 기절할거같아  행사 마지막 날 아침에 일어나기 너무 힘들었다 그리고 날씨도 너무 추웠음 전날 비 와서... 
27,네..... 일요일도 우리 복숭아 작업을 했는데 박스를 개정도 가뿐히 접었답니다? 네 쉬워요. 준비물 동태눈+노래 이게 누가 이런거 했어 말도 안돼. 가사 쓴거지? 거짓말이라고해줘 누구 재능 놓친거자나. 시골... 
28,말 많은 일기로 컴백  할머니 할아버지랑 올공 너무 더웠는데 날씨 너무 좋았다 태국음식점 갔는데 블루리본 잔뜩이었고 이 매콤돼지고기볶음에 밥이랑 튀긴 후라이랑 먹는거.. 최고맛있엏다  에버랜드 오후권... 
29,우리 집 고양이들의 일상을 고발합니다 이름 : 봄 나이 : 살 취미 : 잠자기 특기 : 잠자기 눈 뜨면 하는 일 : 밥 줄때까지 몸통박치기 하면서 애교부리기 밥 먹으면 하는 일 : 다시 잠자기 이름 : 깜 나이 : 살 취미... 
30,"아이디어가 고갈되었는지 뭘 써야 한다는 생각이 안 든다. 아니, 정확히는 쓰고 싶지가 않다. 장소가 정해진 터라 생각의 폭이 좁아진 걸까. 전에는 어떻게 썼더라. 가볍고도 자유로이 쓴 기억이 나는데. 아무래도... "
31,이번주 블챌입니당 이거 마켓컬리에서 파는 끼리찰떡뭐시기인데 저거 껍데기가 두겹인게 넘 웃겨서 찍어놈. 별 게 다 웃긴 시험기간의 대학생. 축복이누나가 알려준 스타벅스 글레이즈드 라떼? 그거 끝나기... 
32,하아이이 오늘은 블챌 쓰는 화요일이구만요 ㅎ 요즘 사진도 많이 안찍고..ㅠㅠ 딱히 올릴 사진이 죄다 음식밖에 없네융 고고띵 퇴근하고 오랜만에 고기만둥 만났당당당당 백만년만에 보는 느낌ㅋㅋ... 
33,한동안 학교에서 루종일 이것만 했는데.. 드디어 을 성공했어요 (근데 사실.. 전에도 몇 번 성공한 것 같은데 try again 보고 계속 다시 한 듯.. 씨*) 아직도 전 김한빈 중독잉에요.. 한빈오빠가 만든 노래 듣고... 
34,"...일 모기 때문에 새벽 시에 잤다. 분명 물렸는데, 잡아서 피도 났는데, 가려운 곳이 없어서 더 짜증나... 가을 모기 시러... ...월 돌아가자~ 청주로~ 오송역에서 학교로 가는 길은 너무 험난하다..... "
35,나는 아이디어 고갈이 아니라 그냥 항상 아이디어가 없었던 거 같은데...  차례 매우 짧고 굵은 내용으로 이뤄져 있다. &quot;먼저 재능이 있어야 할 것이다.&quot; 나는 재능이 없눈거 같은뎅.. 근데 진짜 아이디어가... 
36,안녕하세요잇 ! 블로그제목 추천받습니다 ~ ^^ 이모티콘 새로받은기념 &gt;.&lt; 이번주도 블챌쭈고 ~ 내가 너무너무너무너무너무좋아하는 바보허웅짤 이때 박새로이머리따라한다고자른건데 그냥바보허웅 ♡ 허웅군... 
37,아ㄴ녕하십니까 저는 지금 정확히 번째 다시 쓰고 있습니다^^ 다시한번 말하지만 저장을 습관화 합시다. 이런 표정의 사람을 본다면 그게 바로 접니다 아픈거 아니니까 놀라지마시구요… 주도성이라곤 도 없는... 
38,*  ~  *  시험기간 스타토 시험도 시험이지만 이 날 간담회 참석해야해서 좀 바빴다 신경 써야할 게 많았던 하루 .. 기빨려 뒤짐 .. 그리고 역시 탈주는 빠를수록 좋다는 것을 다시 한 번 느꼈음 역시... 
39,잇님들(명)!!!!! 안뇽하쎄요!!!!!!! 한 주 잘 보내셨는지요 저는 매우 긴 한 주를 보냈읍니다…. 왜인진 모르겠고요 그냥 체감상 긴거 같아요 우선 이메다처럼 보이는 그림자 저 날은 발가락 아파서 조퇴한 날…..... 
40,색 왕창 내보고 싶어요! 사이즈는 좀 크게! 사실 할일은 태산 같으면서도 또 그 뒤에 일을 벌리고 싶네요 아무말 대잔치여도 좋으니 아이디어 막 던져주세요! 옛날거 사신적 엤다면 그거 리뉴얼 해주세요 도 좋아요!!
41,하이 할말없네요 저번거 이어서 Previous image Next image 뒷마당 놀러와준 야옹짱 옆집? 고양이라는데 요즘은 안놀러와 왜 ㅠ Previous image Next image 옷사고시퍼라… 요즘 이런광고 뜰때마다... 
42,벌써 체리벨에서 산 스티커로 어떻게 꾸며볼까 하는 아이디어 고갈... (이게 무슨일이람) 연애 권태기 같이 조금 질리는거 같기도 하고 익숙하게만 느껴지고ㅋㅋㅋ 심지어 뉴페이스를 원하는 것까쥐!! 스티커... 
43,안녕하시와요 이번주 블챌 start 친구랑 코난 보러가기로 했는데 옛날에 코난을 잘 안보기도 했고 극장판도 처음이라 큰 내용 잘 모른다했더니 코난 한번이라도 본 사람이라면 아는 코난 약먹는 얘기를... 걍 웃김... 
44,괜히 인형 옷 마무리 해줄 수 있다고 철썩같이 약속한 모양이다. 할머니는 능력부족이다. 머릿속으로 생각하는 것과 결과물이 다르다. 작아서 못신게 된 양말을 잘라서 만드는 니트의상보다 차라리 내가... 
45,등교 준비 완전 나 같음 블로그 시작 ~ .. 축제 부스를 위해 솜장 하우스 방문 ^_^ 시간 동안 달고나 만듦.. 오왁마 오늘도 왁굳형으로 마무리 ..~ 헉 기엽다 천사제 ~~ 생각보다 첫날부터 부스가... 
46,안녕하세요 뿡집사의 못난 아이디어 고갈로 인한 다이소 장난감 출현 ㅋㅋㅋㅋㅋㅋㅋㅋㅋㅋㅋㅋㅋㅋㅋㅋㅋㅋㅋㅋㅋ 오늘 저는 일 끝난 후에 또 컴퓨터를 켜지요 오또컴 (오늘도 또 컴퓨터) 오늘 다이소 장난감... 
47,하하하하하 지찬이 너무 귀엽다 cm의 수상할 정도로 귀여운 야구선수... 요즘 야구선수는 아이돌이나 다름없는 취급을 받는 것 같다 팬들을 위해 년씩 어려진 지찬이를 보십시오 야구 팬서비스 문화가 많이... 
48,안녕하세요를레히 오늘은 화요일인데 매우할일없어서 블챌을쓰렵니따. 구경하세요 .일 퇴근하구 엄마랑 마트가서 장본후에 의도치않은 전나 대용량 카레만들기 덕선이 엄마st 손큰여자 매우 맛있읍니다... 
49,?? 류준열 봄 사실 태리랑 김우빈을 레알 코앞에서 봤는데 그걸 못 찍엇어 암튼 태리씨.. 코로나 쾌차하시길 한산 팀도 봄 좌 헤어질 결심 우 날라차기 앗싸~ 이거 체육관 언니가 알려준 오렌지주스+크림 조합인데... 
50,"#책리뷰 #책 #독서 #디자인서적 #디자인 #디자이너 아이디어가 고갈된 디자이너를 위한 책: 그래픽 디자인 편 저자 스티븐 헬러,게일 앤더슨 출판 더숲 발매 ... 이 책은 디자인을 하면서 깔끔,감성,심플만... "
51,뭐했다고 월 말인 것 인가 약간 월은 비멍하다가 한 달 다 보낸거같은데 비멍도 끝나고 진짜 살인더위 진ㅉㅉ자짜 거짓말쟁이 기상청이 정말 거짓말쟁이가 되는 조각 구름 따위를 어떻게 예측하는데!!!!!!... 
52,아이디어 개 쓰기 시작합니다. 블로그를 쓰다보니 다른 사람들은 어떻게 작성했는지 유심하게 보게... 나올 정도로 어떻게 이렇게 할 수 있는지 궁금했다 무언가 발전이 필요하다 오늘의 아이디어 개 적기. 끝.
53,냅다 바다로 시작 고도리랑 광안리 갔던 날 카페 입장 도장 찍어주는 쿠폰이 아니라 갈매기 스티커를 바다 일러스트 위에 붙이는 형식이었음 … 원래 지류 쿠폰 잘 안 받는데 강박적인 레퍼런스 수집본능... 
54,"오랜만에 챙김만 받다가 막내노릇 좋아해줘서 고마워 언니오빠야 여기 ,, 너무 맛있는데 가격이 ,,, 정신차려보면 지갑이 털털 그리고 비밀인데 주인장님 얼굴이 .. 유잼입니다? 이거 서비스로 한 잔 주셨는데... "
55,"진짜......이대로 가다가 블챌 못할 것 같아서 일상도 몇 개 올림 ㅎ 원래 월 단위로 일상을 올려서 안하려고 했는데 진짜,,,,도저히 못하겠음,,,이거라도 해야 블챌 성공할 것 같아서 일상도 적어봅니다... "
56,분명 고데기 껐다고 생각했는데 알고 보니 켜져 있었어.. 년 쓰면서 이런 일이 없었는데 나가기 전에 확인하니까 이랬어 깜짜기야 근데 사실 저거 시간 동안 켜두면 알아서 꺼짐 년 만에 할머니 집에 갔어... 
57,씨발 이정도면 나 오만원줘라 아이패드줘라 나도 힘들다 미리 쓰고 있는데 그 와중에 알바비 들어옴 급 행복해짐 님들도 행복하세용~~헤헤 카드지갑 추천 하고 나가라 가볍고 버스카드 바로 찍히는걸로
58,"안녕 바로 시작할게 하나 둘 셋 뿅 이날은 염이랑 데이트했다 완전 오랜만에 만나서 너무 반가웠음 ㅠ 만나서 덕천 가깅 ~ 돈까스 냠냠 하고 카페 '어디'로 이동 슝 냠냠 케이크가,, 너무,, 귀여워,, 블로그... "
59,"[독일워킹홀리데이: Frankfurt] 디자인 아이디어 고갈 현재 일하고 있는 미니잡은 시작은 여러가지 보조업무였는데, 어느 순간 디자인담당 업무로 바꼈다. 전문적인 일을 혼자 해야하다 보니 부담감도 크지만... "
60,"중간에 아이디어 고갈,버그,,,포함 항상 제가 세트로 배포하는 요상한 습관으로 인해 하드에서 썩어가는 것들 요기에 투척하구 가요,, 일단 요기 투척해놔야 진행할수 있을것 같아서링,,, 괜히 하드에 놔두면... "
61,여자아이 머리묶기 넘 힘들어요.. 오너가 어찌나 까다로우신지.... 요구사항이 아주 디테일하면서도 뭔지 모르겠어요;;;; 여자아이 머리스타일 아이디어 고갈이네요. 새로운 아이디어 있으신 분 도와주세요~~~~
62,그래도 주 수업 중에 주만 하기로 해서 부담은 조금 덜한데 문제는 이미 년이나 해서 학기째인 지금은 아이디어 고갈 상태라는 점입니다. 누가 올지도 모르는 상태이고 학생들마다 선호하는 내용도... 
63,"음, 이 아이디어라는 게 참, 고갈될 수가 없는 거 아니겠습니까. 이런저런 경우의 수를 생각해보면.. 도저히 끝이 날 수가 없는거죠. 무시무시 하다니까요. 스스로 뭔가 음악은 이래야된다는 틀을 만들어서 그... "
64,어어....아이디어고갈이닷..아이디어 썰 올려주시고 링크주시면 그거 연성해드릴게요!!
65,"일단 이 영화는 적어도 초반부는 어느 정도 웃기는 영화인데, 후반으로 다가서면서 아이디어가 고갈나는지 스스로 자신을 복제한다. 결국 앞에서 웃겼던 행동을 똑같이 반복하니 후반으로 갈 수록 지루해져만... "
66,하지만 아이디어 고갈의 압박에서 벗어날 수 있는 가장 좋은 방법을 묵혀두는 게 현명한지 궁금하다. 그렇다고  제작진이 뛰어난 창의력으로 빛나는 사람들로 구성된 것도 아니고 사실상 그 정 반대인... 
67,으허허 안그래도 요즘에 CD 앞 라벨 만드는거 아이디어 고갈되가지고 진짜 곤욕 치르는뎅; 오늘은 뭐 거의 분 분 만에 후딱 만들어서 언능 보내야 한다고 하도냥 재촉을 하셔서; 진짜 암울했는뎅; 그래도... 
68,달팽이그리기 페이지 정도 하니 이제 다른게임을 하자고 ㅋㅋㅋㅋㅋㅋㅋㅋㅋㅋㅋ 전 이미 아이디어 고갈... 그래서 시작된 동물그리기게임.. 무조건 뒤에 &quot;게임&quot;이라는 단어를 붙여야 해요. 아이가 게임을... 
69,() .. &lt;밥.먹.자&gt; - 고추장볶음밥 : 진짜 요리 아이디어 고갈일 때! () .. &lt;밥.먹.자&gt; - 크로크무슈 : 버섯크림파스타 맛이 나는 토스트(가 원래 아닌데...) () .. &lt;밥.먹.자&gt; - 롤캐비지 : 양배추... 
70,오늘은 여러 생각 끝에 더숲에서 나온 『아이디어가 고갈된 디자이너를 위한 책 : 그래픽 디자인 편』책 중에서 몇 가지 개념을 소개해드리려고 합니다. 종이를 자르고 붙여서 작품을 만드는 것은 어린아이들이... 
71,"오늘은 『아이디어가 고갈된 디자이너를 위한 책』이라는 책을 소개해드리려고 해요~ 저자 스티븐 헬러와 게일 앤더슨에 대한 소개를 간단히 해드리자면, 스티븐 헬러는 년간 &lt;뉴욕타임스&gt;의 아트 디렉터를... "
72,"아이디어가 고갈된 디자이너를 위한 책 - 그래픽 디자인 편 스티븐 헬러(Steven Heller), 게일 앤더슨, 홍주연  도서출판더숲   평점 상세내용보기  리뷰 더 보기  관련 테마보기 아이디어가 고갈된... "
73,"전 제발 그러지 않기를 바라지만 아이디어 고갈이거나 매너리즘이 아니라고 가정할 때, 정말 안좋게 표현하면 '헤기라는 미소년 마공캐가 수요가 있으니까 급하게라도 만들어서 한탕 해보자. 카록개편? 뒤로... "
74,디자인프레스 X 도서출판 더숲 &lt;아이디어가 고갈된 디자이너를 위한 책 : 로고 디자인 편 &gt; 증정 이벤트 [응모방법] 공개 댓글로 책을 받고 싶은 이유를 적어주세요. 추첨을 통해 선정된 분께 따끈따끈한... 
75,(별로인 듯 해보이지만 작품이 나에게 주는 느낌은 훨씬 다르게 다가왔다. 지금까지 아이디어가 떠오르지 않는 사람들에게 도움이 되는 책 '아이디어가 고갈된 디자이너를 위한 책_일러스트레이션 편'이었다.
76,&lt;지금은 아이디어 고갈 상태입니다&gt; 사진 : http:shop.h-concept.jp AND 디자인올림픽(나의카메라) 디자인 올림픽에 가서 탄성 했던 그 핀이야 말로 내가 원하던 yo - 아이디어 팡팡... 
77,비디오 에디팅홈페이지 제작에세이지금하고있는 이 DVD 커버까지 네개의 과제가 다담주까지인데 ㅜㅜ DVD 에서 너무 시간을 뺏기고있네요 ㅠㅠ 오늘밤은 아이디어 고갈로 여기서 멈춥니다 ㅜㅜ 이웃님들... 
78,다른 선배 마미님들의 조언과 장난감 추천 부탁 드립니다- 이건 할미의 아이디어. 아주 음청 좋아한 딸기 주무르기! 바나나로도 해주고 아래 나오지만 국수로도 해줘봤는데... 딸기만한게 없더라! 색감도 있고... 
79,"아이디어가 고갈된 디자이너를 위한 책 세트 : 그래픽 디자인 편, 로고 디자인 편, 타이포그래피 편, 일러스트레이션 편 (총 권) 전 세계 전설적인 디자이너들이 알려주는 '새로운 아이디어'의 비밀!... "
80,독창적이어야 한다는 걱정은 버려라.&quot; -세기 그래픽 디자인의 선구자 폴 랜드 얼마 전 출간되어 여러 온라인 서점들에서 예술디자인 분야 베스트셀러로 올라가 있는 &lt;아이디어가 고갈된 디자이너를 위한 책... 
81,"아이디어가 고갈된 디자이너를 위한 책 : 일러스트레이션 편 저자 스티븐 헬러, 게일 앤더슨 출판 더숲 발매 ... 이 책 제목을 보고 반가워서 집어든것은 아니다. 요즘 나는 딱히 아이디어를 낼 일이 없다.... "
82,아이디어의 고갈이 문제. 썬도그 . . . : 제가 중고등학교때 구매한 크리스마스 씰입니다. 크리스마스 씰은 후진국형 병이라는 결핵환자를 돕기 위해 우표모양의 기금모금용으로 매년 발행하고... 
83,"엄마표 미술을 해오고 있는 저는 극심한 아이디어고갈로 놀잇감을 주문해보았습니다^^ 쿠팡에서 찾은 민화샵EVA인데요, 유치원 참여수업때 했던 것들이 많이 있더라고요~! 개별 가격은 모두 원 이내였고... "
84,"신혼 밥상차리기 ♪ 아이디어 고갈중 ㅋㅋㅋㅋ 신혼이 된지 얼마나 됐다고. 신혼 밥상, 아이디어가 떨어지고 있어요 ㅋㅋ 이제 내 한계라며 . ㅋㅋㅋ 더 이상 새로운 음식을 할 수가 없다며 ㅋㅋㅋㅋㅋㅋ 매번... "
85,그나마 낙으로 살던 야매요리도 생각이 안나.....에잉에잉....엉엉엉 아이디어를 주슝.... 이 멘붕변죽녀에게 빛을 주슝.......... ㅋㅋㅋㅋㅋㅋㅋㅋ 핑거푸드 아이디어를 주슝... 후라이소녀와 한참을 대화... 
86,하트 아이디어 고갈되었다며ㅠㅠㅠ 왜 볼 때마다 뭐가 늘어있어ㅠㅠㅠㅠㅠ 이 예쁜 사람아ㅜㅜㅜㅜ 아 진짜 남우현 천상 아이도루ㅠㅠㅠㅠㅠ 뒤에 물러나서도 씐난 우효니 봐죠ㅠㅠㅠㅠㅠㅠ 망망이야ㅜㅜㅜ 눈... 
87,"스킨 아이디어 고갈...? 블로그 스킨.... 번째까지 왔다. 사실 올해 번째를 채우고 싶었지만, 매번 아이디어도 문제가 있고... 사실 이렇게 스킨을 단색으로 처리한다는것은 그만큼 아이디어가 없다는... "
88,님들 살려주세요.. 언텔 상황문답 아이디어 고갈 됐음요.. 소재 신청 해주세요..ㅁ
89,금세 밀리는 일기- 삼천포에서의 생활은 하루하루가 소중♥ 매일 똑같아 보여도 잘 기록해둬야지!! 가을 시작될 즈음 비오니깐 에코백에 따뜻한 커피 뤼요네 조식 뤼요네 저녁 장을 보긴 보는것 같은데... 
90,"까보쩜빵 판매할 상품들 모두 재단해놓고 재봉질 할 차례만 남았는데, 왜 그렇게 스위치 켜는게 싫던지 ... 하늘은 뿌얘도 봄이라 근가봐 ~~ 마침 아는 동생이 살짜리 딸이랑 놀러와서 이틀을 지내면서 신나게... "
91,"이제 전자책으로도 &lt;아이디어가 고갈된 디자이너를 위한 책&gt; 시리즈를 모두 만나보실 수 있습니다! 그래픽 디자인 편 외에도 로고 디자인 편, 타이포그래피 편, 일러스트레이션 편의 전자책을... "
92,제목뭐하지 어느날 한 소녀에게 떨어진 드레스코드자컨 하...내가생각한건이런게아니엇어요 초록색옷이라니뭔말도안되는소리임 하지만오빠들아 원한다면 이런거라도 하고가려고요 퍼플사워블렌디드? 라는 걸... 
93,안니옹 슬슬 귀찮아지고 있어서 이제부터는 매주 오늘이 마지막 포스팅이라는 마음으로 작성해 보겠습니다. 여름이었다... 당연함 여름임 월 마지막주 사진으로 시작합니다. 이 날은 그냥 집에 가고... 
