,0
192,"증진 아이디어 공모를 실시해 군민들의 창의적이고 실현 가능성있는 아이디어를 모집한다. 월일까지... 일손부족 해결) 등이 해당된다. 보육-교육분야는 사회적 돌봄체계 확충, 지역 맞춤형 인재양성을 위한... "
193,"토드 부크홀츠, 『죽은 경제학자의 살아있는 아이디어』읽기, 제 편, 마지막! 존 메이너드 케인즈 !!!... 케인즈의 이론은 크게 ) 정부의 지출, 적극적인 개입이 필요하고, ) 수요부족을 해결하기 위한 소비... "
194,반짝이는 아이디어를 가진 청년들이 자신의 꿈을 현실로 실현하기 위해 창업에 나서고 있습니다. 청년... 청년 창업은 청년 스스로가 미취업 상황을 해결하려는 일자리 정책으로서의 목적 역시 만족하기... 
195,퇴사 후 애플리케이션을 만드는 스타트업에 보안 개발자 인력이 부족해 보안 이슈가 계속... 보안을 해결할 수 있다. 락인컴퍼니 리앱 홈페이지(https:liapp.lockincomp.com) 이처럼 창업 아이디어는 문제에... 
196,"출처: ..-어린이동아 일본, ‘사람 장기 가진 돼지’ 연구 허용 &quot;장기 부족 해결&quot; vs &quot;인간과 동물... 교육 아이디어큐브 하남신장센터에서 다양한 프로그램으로 아이들과 재미있는 교육 프로그램이... "
197,"당장 몇 주 전만 해도 '요소수 공급 부족 사태로' 전국의 경유차들이 멈췄고, 작년부터 계속되고 있는 '차량용 반도체 공급 부족' 사태는 매번 곧 해결된다고만 할 뿐 전혀 해소되지 못하고 있다. 세기의... "
198,이런 아이디어는 누가 냈는지 궁금하네 ^^ 미니 압축봉 개 미니 사이즈라서 돌돌 돌려 길이를 빼내도 그다지 길이가 길지는 않다. 보자보자 이걸 어디에 쓰지? 냉장고와 싱크대 사이 아주 좁은 공간 바닥에는... 
199,가구 아이디어라는 생각이 들었습니다. 방이 작아서 침대 협탁을 놓기 힘든 경우 이렇게 벽면을 공략하면 의외로 쉽게 문제를 해결할 수 있으니까요. ▲ 위 링크는 오래전에 제가 직접 만들어서 썼던 벽걸이 침대... 
200,&quot;라고생각함으로써 문제를 해결하고 아이디어를 도출하는 발상법.철저히 자신의 주장과 관점에서... 자신감 부족 -&gt; Why? 못생긴 얼굴-&gt; Why? 비만 -&gt; Why? 운동하지 않는 생활 습관 . 사다리 기법... 
201,연구진은 남아프리카 나미브 사막에 사는 딱정벌레에서 아이디어를 얻었다. 이 딱정벌레는 안개가 낀 아침이면 물구나무를 선다. 그러면 등에 나있는 돌기에 물방울이 맺혔다가 입으로 굴러 떨어진다. 문제는... 
202,공동의 목표를 달성하는 과정에서 문제가 발생하였을 때 본인의 아이디어를 통해 해결하였던 경험을... 이는 내부 인력의 부족함 속에서도 의료진과의 일정을 모두 재확인해야하는 '불필요한 행정력 소모'로도... 
203,"그러면, 조금 더 이해하기 쉽게, 취업하는 분들의 문제 해결 방식을 생각해볼까요. 중위권 대학... 그러다보면, 자연스럽게 아이디어가 나옵니다. 논리력과 창의력, 실행력은 모두 맞닿아있다고 생각해요.... "
204,문제점들을 해결하기에는 과정이 복잡할 수 밖에 없습니다. 그래서 오늘은 특허분쟁에 대해 알아보는... 비슷한 아이디어가 많을 수 밖에 없는 지금 다양한 분쟁이 늘어나고 있다는 것을 볼 수 있습니다.... 
205,다양한 아이디어를 공유하면서 저도 많은 것을 배운 것 같아 좋은 경험이었습니다! 부족하지만 잘... 감사합니다~ 멘티 박*진 이렇게 궁금증 해결 프로젝트의 자그마한 이벤트였던 '공연기획 아이디어 경연대회... 
206,"되면 부족한 도서관자리, 불편하고 미관을 해치는 교내 차량 및 주차 문제 등을 해결할 KUUC프로젝트.... 색다른 아이디어를 통해 해결방법을 모색해본다. 이에 뒤따르는 기대효과까지 제시하며 새로운... "
207,&lt;강일마을넷&gt; 운영진들 만나 주민이용 공간 부족문제 해결방안 토론 강동구의회 진선미 의원은... 다양한 아이디어 또한 함께 도출하는 시간을 가졌다. 마을넷 운영진에 따르면 “현재 마을공동체 활동이 점차... 
208,'누워서 불끄고 싶다' 실현시킨 아이디어 창업 기업은 한 번 쯤 자금 부족에 시달리는 등 큰 시행착오를... 자연스럽게 불편함을 해결할 수 있는 방법을 찾기로 했습니다.” 아이디어만으로 창업을 실행하기는... 
209,[재밌는 이야기] 년 기발한 아이디어 상품 Top  발명품 자고로 아이디어 하나면 평생을 먹고 살 수... 에너지 부족사태는 금새 해결할 수 있을 듯;; . 자동 평형 유지 외발 자전거 정말 이건 위대한 과학의 힘... 
210,"대책에서 부족했던 정량화, 시뮬레이션 문제를 해결하기 위한 서비스를 소개하였습니다! 차세대융합기술연구원은 앞으로도 스마트시티 데이터를 활용한 예비·초기 창업자들의 비즈니스 아이디어가... "
211,"신랑의 재택근무라는 상황이 평일에도 주기적으로 집밖으로 나오게 만들었고 , 카페나 스터디 카페로 나와 공부하다보니 글을 쓸 꺼리도, 유튜부에 대한 아이디어도, 만들고 싶은 앱에 대한 생각도 정리되고... "
212,수납 공간 또한 부족해서 자주 사용하는 물건들은 정리가 안 된 채로 밖에 나와 있는 경우가 많은데요. 이를 해결할 수 있는 아이디어 제품으로 코너선반이 있습니다. 코너선반은 욕실의 자투리 공간을... 
213,"본 사례에서 봤듯이, 공공디자인은 반드시 새롭고 참신한 아이디어일 필요가 없습니다. 기존의 부족한... 그러므로 공공디자인에 관심 있고, 일상의 불편함을 해결할 수 있는 좋은 아이디어가 있다면, 주저하지... "
214,"부족한 정보나 데이터를 어떻게 얻을지 생각. . Red Hat : 직관, 감정, 본능에 충실. 이유는 필요... 갤러리를 둘러보면서 새로운 아이디어나 문제해결을 위한 시작지점을 찾아본다. Ice... "
215,위의 가지 내용을 바탕으로 대기측정소 자체에 부족한 현실과 실제 대기측정 장소와 시민 거주지역과의 거리가 멀어 측정서비스에 대한 불신이 많다. 이를 해결하기 위한 아이디어 선정을 진행하였다.... 
216,그는 영재들조차도 미래지향적 자세와 기능 및 창의력이 부족하다는 것에 충격을 받고... : 해결 아이디어의 생성 - 과정 요소 : 행위를 위한 계획 단계 : 판단 준거의 생성과 선택 단계 : 판단... 
217,"인간관계에 많은 관심을 보이지 않으며, 논리적이고 분석적으로 문제 해결하기를 선호한다.... 있음 아이디어는 많으나 계획성이 부족할 수 있음 자기주장이 강하여 주변에서 지적자로 비칠 가능성... "
218,오늘은 자석을 이용한 공간활용아이디어인만큼 평소 스테인리스 제품을 좋아하시는 분들이나... 뭔가 부족하다고 싶은 분들 있으시죠? 이럴 때 마그넷을 이용해 연출해보세요. 레스토랑에서의 오픈된 주방에서... 
219,"좋은 아이디어죠! 부족한 수납도 해결하고 미니멀라이프가 같이 적용된다면 자랑하고 싶은 좁은 방 인테리어가 될 거예요 의자도 되고 식탁도 되고, 침대 가림막까지! 가지 용도가 되는 침대 헤드는 재치... "
220,실행해보자 아이디어와 실행력을 모두 갖춘 사람이 있다면 정말 축복받은 유전자일지도 모른다. 나는 남편과 서로서로 부족한면을 채워주면서 살아가고 있는 중 시에 일어나서 글을 끄적이고 있는데 갑자기... 
221,생각과 아이디어가 넘치는 한 해가 된다 남들이 하지 않는 기발한 생각을 현실화시키기 위해 직장을... 자신의 부족한 부분을 보완하는데 많은 지출을 하게 된다 보통 상담에서도 이렇게 말씀드리면 무슨... 
222,시설조차 부족하다. 터키가 재활용하기로 약속한 대부분의 플라스틱을 실제로 소각하거나 매립한... [출처]플라스틱 폐기물 해결 방안 아이디어  작성자플라스틱사이언스 https:log.naver.comscience... 
223,"제가 년도에 제 회 아모제 푸드 외식아이디어 공모전에참석했던 기획서 입니다. 먼저... 첫 째 입지조건의 한계, 둘 째 브랜드 컨셉의 모호, 셋 째 홍보 부족을 해결하기 위한, 즉 외식업계의 카사노바가... "
224,"대체투자 상품 통합 플랫폼 프랩 개발기 창업 기업은 한 번쯤 자금 부족에 시달리는 등 큰 시행착오를... 살려 아이디어 구상 더비비드 즐겁게 학창 시절을 보내면서 창업 기회를 노리던 중, 흥미로운 현상이... "
225,부족 . 신속성 . 장작 패기 . 단정 . 예와 정성 . 자유 . 숨은그림찾기 . 문제 제기 . 사고의 특성 . 권위 . 결과 . 백업 시스템 . 그만한 이유 . 메모 . 반론 . 문제 해결 . 인간의... 
226,능력의 부족에 있다는 것을 알아냈습니다. 홀로 거주하는 지적 장애인의 안전한 생활을 위한 해결방... 방법으로 아이디어를 도출하였습니다.  수요자 심층인터뷰 및 현장조사  이해관계자(장애인복지관)... 
227,이번에는 &quot;아이디어 발상과 창의적 문제 해결&quot;에 대해 정리한 내용을 공유하도록 하겠습니다.... 통찰이 부족하고 목표에 이르기까지 시간이 많이 걸림. ⑦ 직관의 재발견 – 지식의 도움 없이... 
228,"유진투자증권대출 부족함을 해결 보다 일반적으로, 앞으로 년 동안 우리는 ESG와 기후 정보 및 투자... 큰 아이디어와 주제 개념 및 진행 방향에 관심이 있는 우리는 매년 ESG Trends to Watch for the next year 라는... "
229,맛있는 아이디어 NOSE TO TAIL 소 한 마리 도시락 JAPAN 일본 전역 일본 도시락 배달 전문 회사인... gochikuru.com 귀뚜라미 빵 FINLAND 핀란드 전역 미래의 식량 부족 문제를 해결하기 위한 대체 식재료로 전... 
230,"공모전은 세계 각 지역의 국민 또는 단체로부터 물 부족, 오염, 재난 등에 대한 ‘도전과제’를... 작은 아이디어와 지혜를 모아 미래를 위한 물 문제 해결의 혁신 기반을 마련하는 계기가 되길... "
231,"공간이 부족한 브리더에게는 당황스런 상황입니다. ㅠ 그러나, 계속 길려갈 개체라면 렉사를 추가가 답이지만 그렇지 않은 개체라면 비용 적게 드는 효율적인 아이디어가 필요합니다. 제가 쓰는 가변 벽을... "
232,뒤에 나오는 아이디어 잡는 방법을 읽어보자. 오늘 수학에서 실수나 시간 부족을 해결하는 방법에 대해서 알아봤습니다. 누구나 실수를 할 수 있습니다. 하지만 실수가 계속되면 습관이 됩니다. 현재 상황에서... 
233,우리나라 대학생들이 물환경 정책과 기술에 대한 아이디어를 쏟아냈어요. 환경부가 주최하고... 대상은 '강원도 물 부족 문제를 해결할 상변화물질(PCM) 이슬응결 장치'를 제안한 숭실대 제로 팀이... 
234,"세가지 요건중 하나라도 부족하면 중간사건이 발생하고, 해결이 안되면 시간과 비용을 낭비하게 되겠지요. 아이디어 특허 등록이 필요하신 상황이라면 계획을 세워 꼼꼼하게 진행하셔야 합니다. 수많은 정보와... "
235,캠퍼스 내 기숙사 부족을 해결하기 위한 대학들의 방침을 살펴보겠습니다. Darthmoutn housing ▶ Darthmouth 대학 좀 황당한 아이디어이기는 하나 다트머스 대학은 이미 기숙사를 신청한 학생들에게... 
236,"현대차 - 만원일때 매수하겠다고 글 썼고 꾸준히 매수해서 에 팔고 나오긴 했는데, 미국에서 호황이 계속될 경우, 마진 잘 안 나오던 자동체 관련 반도체 공급 부족 이슈가 해결될 경우 더 상승할... "
237,혈액 부족 사태에 해결 방안? 안녕하세요!! 요즘 포켓몬빵 인기로 정말 편의점마다 몸살을... 기발한 아이디어로 어려운 시국을 해쳐나갈수있다고생각해요~!!!! 삽립에서도 검토하겠다고하는데.. 어떤 사람인지... 
238,"파악하고, 부족한 부분을 확인해 개선할 수 있기 때문입니다. 하지만 문제는 출원 조회 방법이 복잡하고, 범위가 넓어 정확한 조사가 어렵다는 겁니다. 개인으로 진행하실 분들은 아이디어 및 발명을 개발하기 전... "
239,아이디어는 있지만 어떻게 실현해야 할지 막막한 젊은 창작자들의 복잡한 고민을 해결해줄 꿈의... 그는 “아직 경험이 부족한 팀원들에게 아이디어를 기술적으로 구현시키는데 도움을 주고 있다” 면서... 
240,창업은 아이디어다. 불편함을 해결해야 하는 문제를 수시로 발견하고 이를 해결하기 위해 팀원들... 먼저 아이디어 도출부터 생각해야 한다. 경험이 부족한 청소년들에게 아이디어를 내게 하려면 네... 
241,이러한 점에서 소비자들이 직접 아이디어를 내놓고 부족한 부분은 해당 분야의 전문가와 의견을 나누어 가면서 문제를 해결해 나가는 점이 매우 유용한 마케팅이라고 생각을 하였다. #기사내의 주요 용어... 
242,"꿈을 이루는 것, 곧 아이디어의 기획을 구성하는 것만으로는 부족하다. 그것이 현실의 업무로서... 넓혀진 아이디어를 과제 해결에 적용하라 ⑦ 아이디어에서는 끊임없이 넓히고 기획으로 나아갈 때는... "
243,"추상적인 개념과 문제해결을 위한 아이디어에 관심이 많다. 자신의 생각을 조용히 보유하며, 상황에... 자신의 능력과 이뤄낸 성과를 적절히 평가하지 못하고 늘 부족하다고 여긴다면, 쉽게 무력감에 빠질... "
244,년 월 일 NSOS조는 물 절약 실천에 대한 창의적 해결방안을 주제로 발표를 하는 수행평가를 했다. 친구들과 여러번 만나 절약방법에 대한 서로의 아이디어를 공유하는 과정에서 어떻게 보면 정말 불가능한... 
245,하수냄새 아이디어 공모는 댓글에 아이디어제목 및 내용을 달아 주세요 http:log.naver.comcolahn... 경사부족으로 유기물이 퇴적‧부패되어 하수관로 단차 지점에서 수중의 황화수소가 공기 중으로... 
246,"OTT 플랫폼을 더 싸고 편하게 볼 수 있는 서비스 창업 기업은 한 번 쯤 자금 부족에 시달리는 등 큰... 년에는 숭실대학교 CEO 육성 사업 창업경진대회에서 최우수상을, 금융위원회의 핀테크 아이디어... "
247,물론 부족한 수납까지 해결할 수 있습니다. 가구를 이용한 공간 연출법은 데드 스페이스 공간을 보완하는 또 하나의 방법입니다. 그냥 두면 활용하지 못한 채 버려진 공간이 되지만 아이디어를 더하면 새로운... 
248,위의 옷은 양면을 뒤집어서 다른 의류처럼 착용이 가능하게 제작된것에 아이디어를 얻었다. .불편함: 단면의 제질의 옷보다 옷의 내구성이 부족하다. 자주 뒤집기 때문에 옷의 깃이 자주 구겨진다. .해결책... 
249,"감성이 부족한 사람은 아이디어를 피워낼 수 없다. © ianjattaglia, 출처 Unsplash _상식을 깨면 세상이... 환자를 빠르게 이송하기를 고민한 병원 이송 팀 구조 대원은 다른 방법으로 해결방안을 찾았다.... "
250,■ 공모명 : 지방소멸대응 인구활력 아이디어 공모 ■ 공모기간 : . . . ~ . . .(일간)... (농촌일손부족 해결) 등 - 교육 분야 * 교육을 이유로 진안을 떠나지 않고 관내에서 양질의 교육을 받을 수... 
251,공간이 부족해짐을 느낍니다. 조금 더 넓게 사용하고 싶고 필요 없는 물건은 치우려고 합니다. 제한된 공간에 새로운 공간을 추가할 수 있는 방법은 없을까요? 'Secondary area'는 이 문제를 해결하기... 
252,이들 세가지를 지방균형발전 부진의 원인으로 보고 아래에서 해결 방안을 차례로 짚어 본다. .... 많은 아이디어에 대해 국민토론 등을 거쳐 제도화를 모색할 때이다. ()외국으로 부터 인구수입을 위한 노력도... 
253,"기능으로 해결할 수 있는 문제다. 기라도라 개발 시 책정된 가격은 약 달러 안팎이다. 수입이 부족한... 아직 확산은 안됐지만, 현지 상황을 적극 고려한 '착한' 아이디어로 평가된다. 테크플러스 에디터... "
254,수원 까마귀 사태를 해결한 살 이대생의 아이디어 . . . : &lt;strong&gt; 데이터로 돈 벌 수 있는 자산 관리 앱 '캐다' &lt;strong&gt;창업 기업은 한 번쯤 자금 부족에 시달리는 등 큰 시행착오를 겪는 ‘데스밸리... 
255,:) 신사업을 위한 아이디어는 넘치는데 회사에서 인정받고 실제 실행되는 경우가 적으시다고요?!... 때문에 문제를 해결할 힘이나 권한이 부족한 상사에게 계속 문제를 제기하는 것은 무의미하다. 문제를... 
256,D프린터 물부족 해결을 위해! 물부족참조 : d닷컴 GE AWE  참조 : d닷컴 GE Research  참조 : d닷컴... 정부에서 다양한 지원을 통해 이공계 청년들에게 기회를 준다면 상상도 못 했던 획기적인 아이디어들이 많이... 
257,"다양한 아이디어를 모아 미세먼지 해결에 활용하는 ‘미세먼지 국민 아이디어 R&amp;D 사업’을 추진키로... 신선한 아이디어를 모으고, 이를 바탕으로 한 범부처 신규 사업을 기획해 미세먼지 연구개발이 부족한... "
258," DSU 창업아이디어 경진대회 성황리 개최 동서대학교 창업지원단에서는 월 일 ' DSU... 또한, 판매되고 있는 제품들은 안전성에 대한 의구심들을 해결하고자 오감놀이 포슬을 개발하게 되었습니다.... "
259,"늘 손이 부족했던 어머니에게 김OO님은 언제나 고맙고, 미안한 아들이었습니다. 그런 '착한' 김OO님은... 문제를 해결해 내는 아이디어 능력 주어진 정보를 자유롭게 추리해 내는 상상력 구체적인 설명 없이... "
260,현실적으로 해결해야 할 과제가 많다고 지적했다. 도심 고밀화 정책 추진만으로 현재 수도권 전체를 덮친 공급 부족 문제를 해소하기에는 벅차다는 것이다. 김승배 피데스개발 대표는 일 매일경제와 통화하면서... 
261,"교육부 국민서포터즈 쏟아지는 아이디어, 해커톤! 교육 현장에서 어떻게 활용될까? 대한민국 교육부... 함께 해결해 나가니까 협력에 있어서 많이 배운 것 같아요. 서로 부족한 부분을 채워주면서 함께... "
262,"많이 부족하지만, 훌훌 잘 봐주세요~~ 영화 버티컬리미트 영화 미션임파서블 암벽등반 사진이라고하면... 좋은 아이디어 있는데 왜 글쓴이가 안하냐? 음.. 핑계랄까? ㅎㅎ 모든것을 다 할 수 없어서랄까... ㅎ... "
263,이런 철분 부족의 문제를 해결을 위해 연구를 통해 '개빈 암스트롱(Gavin Armstrong)'이 '럭키 아이언... 공급 아이디어를 고안해 낸 것입니다. 음식을 조리할 때 철 덩어리를 넣는 것만으로 하루 필요한 철분... 
264,물부족을 해결하는 멋진 아이디어 이동식 정수기 자전거 아쿠아덕트(Aquaduct) 유니세프의 통계에 따르면 전세계적으로 만의 인구가 깨끗한 물을 마실수 없다고 합니다.아프리카의 많은 국가들은 물부족으로... 
265,"결국 해외로 나가거나 생산설비 자동화를 통한 문제해결이 필요한 산업인데, 딱히 그렇게 움직이는것... #종목투자아이디어 근거. 특히 지금 면화가격이 엄청 오르고 있음. 역사적 신고가에 도전하고 있는... "
266,"국토교통부 보도자료 미세먼지 해결방안에 대한 국민 아이디어 모은다! 정부는 월 일... 신선한 아이디어를 모으고, 이를 바탕으로 한 범부처 신규 사업을 기획하여 미세먼지 연구개발이 부족한 분야나... "
267,어린이 뉴스 [사이언스] 물부족 해결 과제 제시한 부부에 ‘X프라이즈’ 장진희 기자 -- :... 이들은 비가 내리는 원리에서 아이디어를 얻었다. 작은 컨테이너 안에 폭우가 내릴 수 있는 조건을... 
268,아이디어가 좋은 거 같습니다. 노트북 사용의 편리성이 더 좋아졌습니다. 그리고 수신기 하나로 마우스와 키보드 동시 사용 가능하기 때문에 us 장착 공간 부족을 해결해 주기도 합니다. 타자감은 부드럽고... 
269,"학기와 같은 매주 차시 온책 읽기 + 학년 말 연극 예정 + 사회 (역사) 시수 부족 으로 인해 재구성이... 호불호가 갈리거나) 도덕은 단원 사이버 예절, 단원 갈등 해결, 단원 인권인데, 단원이야 맨날 하는... "
270,마음을 비우고 떠오르는 아이디어를 하나씩 천천히 정리해나가는 것이 오히려 도움이 된다. freepik... 웬만한 것들은 모두 스마트폰으로 해결 가능한 시대 아니겠는가. 마인드맵 역시 모바일에서 손쉽게 그릴... 
271,점을 해결해 줄 아이디어를 그림으로 그립니다. 그리고 그 아이디어를 인터뷰 대상자에게... 멋진 아이디어를 뽑기 위해서 투표를 했다. 너무 파격적인 아이디어는 이틀 안에 제품을 만들기에 부족했기... 
272,"올해 과제는 지구촌 물부족 위기를 해결할 수 있는 아이디어인데, 이를 위해 지켜야 하는 규정은 쉬운 것 같으면서도 까다롭다. 참가팀은 대기로부터 하루 최소한 L 이상의 물을 추출해야 하되, ... "
273,특히 우리나라는 다른 나라에 비해 정보 보안쪽 인력히 현저히 부족하다고 한다. 말씀을 듣고보니 정말... 기존의 신사업 아이디어는 문제인식 --&gt; 해결방안 도출 --&gt; 사업 계획 수립 --&gt; 사업화 의 순서를 따르는... 
274,아이디어가 부족한 나에겐 정말 큰 힘이 되는 책! 하나하나 해보고 우리아기는 어떻게 반응하는지 보는것도 재밌을 것 같다. 아~ 우리아기는 이런게 다르구나~ 하며 느끼는 것도 있을 갓 같고~ 매일 뭐하고... 
275,이해력이 부족한 외국 아이돌들을 지금처럼 열렬히 지지해 줄지도 의문이다. 그래서 현재 중국시장을 목표로 하거나 데뷔할 계획이 있는 기획사들이 있다면 중국 미디어와 기획사들의 앞으로의 행보를 반드시... 
276,"실용신안 등록 방법 경험이 많은 곳에서 해결해요 실용신안 난이도 특허, 실용신안을 알아보신 분들은... 사업 또는 아이디어 개발 전 참고하기 위해 선행기술조사를 진행하시는 거라면 카프리스를 통해... "
277,특허를 획득하기 위해서는 출원 및 등록을 하고자 하는 아이디어이나 기술이 요건에 충족을 하는지를... 특허인 경우 대다수 진보성 부족의 사유로 거절되는 경우가 많습니다. 그렇기 때문에 진보성에 대한... 
278,일을 해결하시는 게 좋겠습니다. . 아이디어 상품 특허 심사 통과 조건 아이디어 등록을 위해서는 꼭... 그래서 유사한 게 없는지 확인하고 부족한 부분은 없는지 계획을 짜서 꼼꼼하게 진행하는 게 유리해요.... 
279,특히 코봇은 작고 안전하기 때문에 기존 기계보다 인간을 대체할 좋은 아이디어입니다. 작업자들도... 과제 해결에 도움을 주었습니다. 구체적으로 그립만 바꾸어도 다양한 작업을 할 수 있다는 것을 알게되어... 
280,"© dead__angel_, 출처 Unsplash 공실상가에 숨어있는 기회와 공실문제 해결을 찾는 사람들의 필요가 증가할... 아이디어 경쟁... 플레이어들의 도전과 실험들... 경쟁이 치열해지기도 하고 장사의 기술이 부족했던... "
281,"콘텐츠 부족 - 관광앱 개발 이렇게 가지가 선정되었습니다! 선정된 가지 세부 문제에 대해 ‘어떻게 하면’ 이 문제를 해결할 수 있을지, ‘어떻게 하면’ 기술과 결합하여 더 좋게 만들지 고민하고 아이디어... "
282,"이부분의 부족함을 채우기 위해 어떤 부분을 보완하였는지 타이틀을 달고, 문제를 정의하며 목적과 해결방안을 적어보는 것이다. 그림으로 설명이 가능하면 좋겠다 ^_^ 부록. 특허출원실전! 당신의 아이디어... "
283,점심도 해결하고 매장에서 사용할 야외테이블도 구매! 여러 컨셉으로 공간을 꾸며 놓았기에 다양한... 이런식으로 공간을 꾸밀때 컬러조합은 어떻게 하면 좋을지 아이디어를 얻기에도 좋습니다^^ 이대로 집으로... 
284,"아이디어 명 #공무원이력제 를 도입하자! 요약 국민이 공무원들의 이력을 살펴볼 수 있도록 하고, 퇴직을 앞둔 공무원들에게 고질적인 민원해결을 맡기고, 민원책임제를 도입하여 본인 민원을 마무리 짓도록... "
