,0
192,②아이디어 고갈로(아이디어가 말라서) 더 이상 새로운 생각이 안 나는 상황이다. ③정서의 고갈(정서가 말라가서)로 사회는 더욱 각박해지고 있다. 국립국어원 홈페이지 &lt;자료출처=국립국어원 블로그 log.... 
193,"요즘 신경 쓰이는 여성들,, 다들 절 가져주세요 리플리의 케이트 블란챗은 걍 햇살 상크미☀️ 특유의 얇지않은 선이 매력적인 플로렌스 퓨 레이디 맥베스랑 작은 아씨들부터 신경쓰이더니 블랙 위도우에서 걍... "
194,월 일 일요일 콜드브루 아인슈페너 사장님께서 콜드브루 아인슈페너 핫 메뉴를 단종시키셨단 이야기를 듣고 환호했다 아니 차갑게 내렸으면 차갑게 먹어야지 뭘 그걸 또 데워요.. 핫 메뉴 만드려면 스팀을 두... 
195,오랜만에 놀이터 디자인을 하려니 아이디어도 생각 안나고... 진도가 잘 안나가네요 ㅋㅋㅋ 어떠한 컨셉을 가지고 하는건 아니고 금액에 맞춰서 다양한 놀이 공간을 만들려고 했어요 요즘은 스케치 할 시간도... 
196,"복고, 아이디어 고갈의 산물인가? 패션의 유행은 돌고 돈다는 말이 있듯 복고(Retro)라는 이름으로 과거의 패션이 현대를 사는 우리 곁에 모습을 드러내는 것을 자주 목격하게 된다. 하늘 아래... "
197,열심히 일하느라 수고한 여러분을 위해 오늘은 잠깐 머리 식히며 읽기 좋은 디자인 추천도서를 한 권 소개할까해요^^ 출처 : YES 바로 [ 아이디어가 고갈된 디자이너를 위한 책 ] 이라는 긴~ 제목의 책이랍니다... 
198,"난 매일 아침 꿈을 꿔.. 확진은 아니지만 미열이 있어 집에 돌아가는 꿈.. 하지만 늘 정ㅡ상,,, 피곤은 하지만 열은 안난다 이거냐 몸뚱이야? 퇴근하고 만나서 나의 빡침썰 듣더니 오느른 증말 맛있는걸 먹자고... "
199,"디자인 전공자, 업계 종사자, 기업과 클라이언트까지, 확실한 아이디어가 없어 밤새 고민하는 이들에게 발상의 통로가 되어줄 아이디어 가이드북을 소개합니다 #배우이주화좋은책추천합니다 #아이디어가고갈된... "
200,하지만 막상 콘텐츠를 만들려고 하면 아이디어가 떠오르지 않아 막막하기만 하다. 우연찮게 재미있는 아이디어가 떠오른다 해도 한 두번 만들고 나면 금방 소재가 떨어진다. 이처럼 지속적으로 콘텐츠를 만들어... 
201,"제목부터 눈길을 끌던 아이디어가 고갈된 디자이너를 위한 책. 종류는 꽤 많았는데, 내가 구입한건 일러스트레이션, 로고 디자인, 그래픽 디자인 편 배우고도 잘 써먹지 못하고 있어서 요즘 만지작 대던 중... "
202,이러한 아이디어 고갈속에서도 나는 생각을 하려고 합니다. 그만큼 아직은 열정이란게 남아잇어서 버팀목이 되어주는거 같아요. 버팀목속에서 나는 더욱 좋은 아이디어를 내기 위해서 최선의 노력을 다해서... 
203,《분 만에 읽었지만 평생 당신 곁을 떠나지 않을 아이디어 생산법》 - 제임스 웹 영 제임스 웹 영은 광고계의 전설적 인물이라고 한다. 그런 그가 &quot;아이디어를 어디서 얻으세요?&quot;라는 질문을 받고 생각에 잠기게... 
204,오엠지 오늘은 늦잠자버렸다 일어나니까 시 ㅋㅋㅋㅋㅋㅋㅋㅋㅋㅋㅋ ㅎ 도른거 아니냐며 자책 .. 사실 시에 본능적으로 눈 뜨고 주식 장 확인 어제와 같길래 그냥 닫고 잠 시에일어나서 모닝루틴 .. 아 지겨워... 
205,"디자이너들이 아이디어가 고갈되었거나, 아니면 디자이너들이 게을러졌다는 것이다. 불황이라는 사회현상을 대변한다고는 하지만, 글쎄...주변에서 적극적으로 미니스커트를 추구하는 여성은 그렇게 많아... "
206,"더숲아이디어가 고갈된 디자이너를 위한 책: 일러스트레이션 편 도서명:아이디어가 고갈된 디자이너를 위한 책: 일러스트레이션 편 저자출판사:스티븐 헬러 , 게일 앤더슨더숲 쪽수:쪽 출판일:년 월... "
207,아이디어가 고갈되었을때..... K 이쁜거 좋아하는 포근마님~ 이쁜척은 안하지만 꾸미면 이쁜 포근마님 ㅎㅎ (정말임 ) 그래서 요런거 넘 넘 좋아해요 물론 요번건 이쁜건 아니지만 K에 가시면... 
208,AM : 지금 내가 꽂힌 노래 울 송송희^^가 하트 했는데 가려져서 안 보임 ㅠ흐앵 저거 치워줘 ㅡㅡ 순서 올리래서 급하게 쳐서 오타 났는데 교수님이 흥분하지 말래 ㅋ 게다가 글씨체도 나만 바탕체임 ㅋㅋ... 
209,"디자인 아이디어가 형태를 이끌 때 개념적 디자인을 하려면 각각의 디자인 요소들 -서체, 이미지... 두번째는 시각적 아이디어를 표현하는 숫자를 만드는 것이다. 이때 숫자는 상징적인 의미를 연상시킨다.... "
210,"월말부터 코로나때문에 주문도 뚝 끊겼고, 아이들도 갑자기 내내 집에 있고, 계획과는 상관없이 틀어져버린 상황. 어쩔 수 없이 아이들이랑만 있는 시간을...갖게 되고, 누리자 . 즐기자. 그렇게 시간을... "
211,말 그대로 로고 디자인 아이디어가 고갈된 사람들에게 추천하고 싶은 책이다. 이 책은 로고 디자인에 관한 아이디어가 가지 실려있다. 그중에서 인상 깊었던 사례를 가지 소개하고자 한다. 숨겨진 힘의 외침... 
212,의외로 자유도가 무한한 의뢰 내용 때문에 아이디어가 막히고 고생을 하는 경우가 발생할 때가 많다.... &quot;세상에 나쁜 아이디어란 것은 존재하지 않습니다. 크리에이티브한 것이란 아이디어를 실현 단계까지... 
213, 색겹치기 - 마이클 비에루트 Michael Beirut - 가장 어려운 부분은 수많은 색과 근사해 보이는 색 조합들을 실현 가능한 숫자로 줄기는 것이다. (이건 참으로 공감이 되는 말이다. 디자인뿐만아니라 삶에... 
214,"아이디어 고갈 _ _ _ 토, :"
215,아이디어 고갈입니다.. 글이 써지질 않네요 ㅎㅎ 한 번쯤 휴식이 필요하겠죠 솔직히 머리에 쥐나는 줄 알았답니다 ㅠ
216,"아ㅏ아ㅏㅣㅏㅏㅏㅏㅏㅏ 아이디어 고갈... 누가 좋은 주제같은거 소개좀해줘요... 막 , 연성이랑 주제랑 보고시픈거 댓에 써주시면 써드릴게오오ㅡㅡ..."
217,학교에서 글짓기 대회 하는데 아이디어가 없어요.. 글 잘 쓰는 법 좀 알려주시분?ㅠㅠ
218, 학교를 갔다가 밀린 과제를 하니 블로그에 쓸 만한 글이 없다. 파판도 들어가지 못했다. 디데이 떠있는 내 강의는 결국 나중에 듣기로 만들어두고 새벽에 듣기로 결정....ㅎ (과연 들을지) 말랑쫀뜩... 
219,쓸게없다 나 이번달 월급 받으면 운전면허 딸거임 딱 기다려~~ 베스트 드라이버의 삶 얼마 남지않았다 (사실 전동킥보드 타고 싶어서 따는거임) 자자 운전면허 있는사람들 꿀팁 알려주고 가셈 난 이만➿
220,요즘 꽃을 어떻게 꽂을 지 고민하지 않는다. 왜냐고? 모른다. 그냥 걱정도 없고 때가 오면 그때 그때 남의 작품보고 약간 변형해서 즉 모방과 변조를 하고있는 셈인데 오늘은 왠지 불안하다. 그래서 작년 이맘때... 
221,하이 여러분 오늘도 내가 왔어. 당연함. 만오천원 받아야됨. 오늘도 두시에 일어난 나. 오늘 나가서 대본 쓰려고 계획했던 시간이 짧아져버렸음. 오랜만에 동암역으로 왔는데 추억의 동암할리스가... 
222,"묻고, 아이디어를 갈구하죠.. 하지만 이것저것 만들어봐도 눈에 차질 않네요 ㅠㅠㅠ 노트북으로... 의견과 아이디어를 듣고 싶습니다 ㅠㅠ 괜찮은거 같은 스킨을 골라주시고 이 부분은 수정(추가)했으면 하는... "
223,"아이디어가 고갈된 디자이너를 위한 책 : 로고 디자인 편 저자 스티븐 헬러, 게일 앤더슨 출판 더숲 발매 ... 단순하지만 강렬한 로고들이 올컬러로 실려 있다. 거기다 이 로고들이 어떤 아이디어로부터... "
224,그 목적에 충실한 책이다. 마침맞게 이런 책이 나와주었음이 고마울 따름이다. #아이디어가고갈된디자이너를위한책 #타이포그래피 #스티븐헬러 #게일엔더슨 #책스타그램 #북스타그램 #o책ok
225,아이디어가 고갈된 디자이너를 위한 책 저자 스티븐 헬러게일 앤더슨 출판 더숲 발매 ... 직장생활 년이 넘었으니 아이디어가 고갈 안되면 이상하지. 요즘 그래픽에 관심이 높아지고 잘하고 싶어서... 
226,아이디어를 주십시오! LoisSparkle 님의 다그커 한다고 했었나? 그래도 확인좀 받구요^^ 다시! 오랬동안 블로그를 않 올렸는데! 제발! 제 채널을 위해 포니 아이디어 신청 부탁드립니다!
227,"애플은 아이디어가 고갈된 것일까. 결과적으로 아이폰 의 경우 아이폰 'S'가 나오던 시절보다도 업그레이드해야 할 이유를 찾기 힘들다. s에는 시리가 추가됐고, s는 터치 ID, s는 D 터치, XS에는 맥스... "
228,"SK내부에 아이디어 고갈되었나 부네..SK로서는 저렴한 가격에 신선한 아이디를 얻으려고 하는군요. 대기업의 횡포와 함께. SK텔레콤, “IoT 청년 벤처기업가 찾습니다” SK텔레콤이 사물인터넷(IoT)... "
229, 전날 밤에 얇게 입고 밖에서 한시간 넘게 전화하다가 감기 걸림..ㅠㅠ 몸이 너무 안 좋아서 칭찌아 때리고 계속 잤다 그러다가 저녁 먹으러 탄으로 이디엔디엔에서 우연히 마주친 한국인 연구생 언니랑... 
230,차적으로 보정완료는 했는데 이제 아이디어가 고갈났다. 일코용 배경을 만들고싶은데 어제 밤하늘에 달 컨샙으로 하나 시도했다가 거지같이되서 그냥 다 지워버렸다 오늘 밤에 찬찬히 다시 만들어야지
231,아이디어가 차오르기전에 고갈됬다.
232,"아이디어가 고갈된 디자이너를 위한 책 작가 스티븐 헬러, 게일 앤더슨 출판 더숲 발매 ... 평점 리뷰보기 &lt;아이디어가 고갈된 디자이너를 위한 책 : 로고 디자인 편&gt;은 로고 디자인을 위한 아이디어를... "
233,나 블챌 주차만에 아이디어 고갈됐는디요..? 그래도 일단 뭐라도 끄적여본다. . 사피엔스는 아직도 덜 읽었다. . 장마가 시작됐다. 날씨는 너무나도 습하고 더워서 불쾌지수 만땅이지만 마른 장마라더니 진짜... 
234,로고디자인을 하겠다고 아침부터 끄적끄적;; 처음에는 신났죠. 그런데.. 아무리 생각해도 아이디어가 잘 안나왔어요 결국..... 자화상을 그리면서 씁쓸함만 남긴..;;
235,뭐할까요..여러분ㅠㅠㅠ아이디어좀 주세요 신박한거 겁나좋아합니다ㅋㅋㅋㅋ 비댓하셔도되고 아니셔도되고 함께하는 이벤트 만들어보아요 XD 뽑는방법도 아이디어주셔도 되구! 숫자돌리거나 이대로... 
236,"아이디어가 고갈된 디자이너를 위한 책 : 로고 디자인 편 저자 스티븐 헬러, 게일 앤더슨 출판 더숲 발매 ... 아이디어+아이덴티티=로고 로고는 아이디어·신뢰·사물을 대신한다. 더 나아가 그들의... "
237,"전 세계 최고의 디자이너들이 사용했던 다양한 아이디어와 접근법, 주제에 관한 안내서로 고갈된 아이디어 속에서 길을 읽은 사람들에게 매우 창의적이고 유용한, 새로운 영감을 제시할 것이다. The graphic... "
238,"이제 티볼 하나만 하면 되는데, 아이디어 고갈이군요.."
239,아이디어가 막힐때나 더 좋은 뭔가를 찾고 싶을 때 영감이라도 받지 않을까 하는 절박함 반 ... 머리라도... ㅎㅎ 머리가 복잡할 때.. 아이디어가 떠오르지 않을 때 대구 미술관을 추천합니다.
240,"목요일 퇴근 후 , 리더선생님과 둘이서 오붓 저녁. 데이트다 ! 데이트 ! 리더 선생님께서 무려 소고기를 사주셨다 . 오예 ! 신흥 정육식당 전 부서에서 일하던 지난 일년 간, 팀 리더선생님과 정이 깊게 들었다. 살... "
241,ㅋㅋㅋㅋㅋㅋㅋㅋ 아이디어는 존재하지 않는다.. 나는 지금 백지이며.. 하얗게 불태웠다.. 만들다 그만두면 뭔가 찝찝한데.. 우짜지 ㅋㅋㅋ 저기서 더이상의 구도가 나오질 않아 ㅠㅠ
242,포스팅...너무 하고 싶은데... 정말 할게 없다!! 할게 없다고 생각하니 정말 정성스러움이 도 없는 것 같다!! 그래서 요즘 내가 하고 있는 일에대해서 쓰려고 한당!! ) 영상촬영 준비 한 여름에 겨울 컨셉 영상을... 
243,밍기적 거리는 몸을 일으켜서 동대문 가기 전에 일상 포스팅을!!!! 저번 주에 아는 동생이 불후의 명곡 쪽에서 일을 해서 친구들이랑 방청하러 갔어요 콘서트나 공연은 많이 가봤는데 방송 방청은 또 처음이라... 
244,"투표를 합시다 투표를 !! 앞머리 너무 자르고 싶어,, 앞머리만이라도 신민아 닮을래,, 김임지연님 베르크 입성 경축 패디큐어 한 지연띠의 발은 뽀인트^^* 고앵이에게 사랑을 구걸하는 림지연띠... "
245,얼마 전 알게 된 '크리스토프 니먼'의 작품을 여기에서 또 만나서 무척 반가웠다. #아이디어가고갈된디자이너를위한책 #일러스트레이션 #스티븐헬러 #게일엔더슨 #책스타그램 #북스타그램 #o책ok
246,한다고(?) 알고 있는데요 저 아이디어가 없어서 지금 연중해야 될거같아요.... 소설이 멈추지 않기를 바라신다면 댓글로 아이디어를 좀 보내주세((... 제발ㅇ((퍽퍽 ㅠㅠㅠ 연중될 위기에 처해있는것들: White?... 
247,"저번주는 진짜 한것도 없는데 일주일이 후욱 - 가부렸다 일하는데 눈이 또 크크 락킹 첫 루틴을 나갔슘다 아 넘 뿌듯하고 짜릿해,, 영상은 비공개 시크릿 이거 요새 유행하는 성격 테스트 완전 나. 그냥 나.... "
248,시에 신아소설 쓸려고 했는데..... 아이디어 고갈났어요~!!!!! ㅠㅠ 이러다 자꾸 미루게되고 소설중단 될듯... 글고 보니 중편도 써야하는데ㅠㅠ걍 주말에 쓸래요 전 이대로 그냥 퇴블하겠습니다 굿나잇~
249," 목요일 요즘 방학이라 애들이 다 강남에 이따 카톡 하나 전화 한통이면 다 집합가능한 부분 왕징 예뿌니덩,, 드디어 만남 지효는 년만에 만난고 실화,,? 근황토크 너무 웃겨서 배아팠다ㅜㅜㅜ 셀럽지효님... "
250,"오늘은 로고제작, 학교가서 학생증 제작 등등 할 꺼 진짜 은근히 많은데;;; 아침부터 그림그리고 있다 ㅎ 머리를 쉬게 해야 아이디어도 잘나오겠지??? -.. 오전에 끄적"
251,YES 리뷰어클럽 서평단 자격으로 작성한 리뷰입니다. #아이디어가고갈된디자이너를위한책 #스티븐헬러 #개일앤더슨 #윤영 #시리즈 #더숲 #디자인 #타이포그래피 #캘리그래픽
252,노래는 좋아요. 안무가... 아 속상해라. 엔믹스.라고 읽는다더라. 올해 JYP에서 먼저 새로운 걸 그룹을 런칭 했다. 엔믹스 N + MIXX 미지수 n 이 어떤 것과 믹스를 시킬 것인지 참 이름 한 번 일 안하나 보다. 처음에... 
253,". 내 이름의 만족도 좋은데, 정시 해야될 것만 같은 그런 느낌이 들어. . 좋아하는 계절과 그 이유 가을이 좋아 시원하잖아! 뭐 당연한 걸 물어보니! . 자부심을 느끼는 것 한 가지 난 재밌어 . 좌우명 또는... "
254,그것을 그대로 들고 와서 예능으로 만들었으니 결국은 작가들의 아이디어가 아니라는 거죠. 누구의 아이디어도 아니라는 거겠죠. 맨 처음 자기 자신이 만들어 먹은 편의점 음식 레시피가 어느 순간 어떤... 
255,소재 고갈 아이디어 고갈 나의 현재상태이다. 요즘 블로그에 미쳐 책 읽고 드라마 보는 시간이 줄다 보니 더 그런 거 같다. 책을 읽고 드라마를 보다 보면 정말 이런저런 소재와 아이디어들이 쏟아질 때가... 
256,음... 요즘 아이디어가 고갈되어 소설도 못 쓰고 잡담만 할것같아요 아이디어 고갈문제도 있지만 제가 요즘 피곤해서 계속 잡담만 하고 다음주 부터 소설 쓸게요!!
257,대체 다른 분들은 하원 후에 어떻게 놀아주는지...넘 궁금 하원하고 뭐하고 시간을 보내야하는지 매일의 고민이다 오늘은 아파트 뒤 남산을 가려고 했는데... 사진 속 무당벌레를 찾아보세요 아이스크림이 먹고... 
258,"개씩 아이디어를 생각해 분 이내에 기입한다는 조건 때문에 ,, 기법으로도 불리웁니다. . 색... 일종의 아이디어 창출의 체크리스트를 통해 다양한 발상을 할 수 있도록 돕습니다. .... "
259,지난 롤에 이어 백빈건널목에서 찍은 사진들로 시작- 사진 찍을 때마다 느끼는 부분이지만 해가 적당히 질 때의 노르스름한 색감은 코닥 골드와 딱 어울리는 것 같다 사진 결과물도 분위기 있게 나와서 내가... 
260,"아직도 아이디어 고갈로 인해 골머리를 썩고 계신가요? &quot;일포스팅에 쓸 주제가 없어&quot; &quot;나는 원래 안되는 X인가봐!!!&quot; 이런 고민 해보신 적 있으시죠?! 또, 막상 자리잡고 앉아서 아이디어를 짜내려고 하니 머리만... "
261,"# 책 읽는 남자는 섹시하다. https:www.instagram.comhotdudesreading • 좋아하는(?) 인스타그램 페이지임미다. 책 말고도 커피 마시는 남자 페이지도 있는데, 그건 너무 작위적이여서 별로. 책, 책, 책을... "
262,내가 할 일은 하루도 거르지 않고 생각하는 일에 기꺼이 몰두 하는 것입니다. 내가 생각을 멈추지 않는한 아이디어는 절대로 고갈되지 않습니다. 자신을 소모시키지 않고 활활 태워 보십시오.
263,요즘도 !!! 역시나 칩거중 입니다 ...^^ 놀러나가고싶다 그래도 냉장고가 드디어 온 덕분에 집에서 이것저것 요리해먹고 있다. 요리하고 설거지하고 청소하고 낮잠자고 요리하고 설거지하고 잠드는 초 여유로운... 
264,이젠 아이디어가 고갈된듯.... 대충 만들었는데... 누구한테 주기가 좀 민망스럽다. 옆에 있는 tag은 target의 불코너에서 건진 스티커를 이용해서 살짝 변형시킨것.
265,"아이디어는 둘째치고 체력이 바닥을 치고 있는 하루하루 아... 눈도 잘 안보이고... &lt;자녀축복기도문&gt; 시리즈였는데, 이번 작업은 기존 작업이 있어서 대체로 수월하게 한것 같다. 시리즈는.. 이래서 참 좋아.... "
266,으아~ 진짜 아이디어가 고갈되고 있다. 디자인을 약 년간 제대로 하지 않있더니 저 세상 감이 된 것 같아!!! 아이디어가 고갈된 디자이너를 위한 책 저자 스티븐 헬러게일 앤더슨 출판 더숲 발매 ...... 
267,하이루 방가방가~~ 이제 본격적으로 알바 두탕 뛰어서 주일에 한 번씩 쓸 만 한 내용이 없다... .. 접시물에 코박은 연진이. 이날도 연진이 내려가기 전에 스파게티 스토리 !! 저번에도 먹었던 치킨도리아와... 
268,"아이디어 없음 룰이건 메타건 너무 ㅈ같아서 제대로 안해서 그런듯 오즈의마법사보고 뇌가 비어버린 느낌 DLC 풀려도 또 븅신같은 비트다운 메타될거 같은데 슬슬 좀 지친다 세대처럼 이제 수비플,사이클은... "
269,라스 취향대로 옷입은 글러트니 엉엉
270,아이디어가 고갈 됐다. 영감이 잘 떠오르지 않는다. 큰일이다. 책 많이 읽어야겠다.
271,#블챌 #오늘일기 고양이랑 아이컨택하고 싶었는데 밥 먹는다고 나는 안쳐다보더라 괜찮아 상처 안 받았어 그 언니네 마카롱 갔는데 사장님은 사실 언니가 아니라 오빠(?) 음 아니 아저씨 였어 근데 저거... 
272,"머리가 점점 나빠지고 있나. 교과서 외 지문을 ~% 섞어서 수능 스탈로 출제하기로 했는데, 왜 이렇게 문제 내기가 어려운거야... ㅜㅠ 시면 쿨쿨 자던 내가, 지금 취침 시간을 시간 분이나 건너 뛰어서... "
273,이런식이라 어차피 어른음식은 매운걸 좋아해서 아이 음식을 같이 차릴수 없음..ㅋㅋㅋㅋ . . 유아반찬 삼시세끼 차리셔야하는분들! 유아식반찬 아이디어 고갈되신분들! 한번쯤 참고해서 보시면 좋을거 같아요!
274,제목그대로다. 블로그 소재가 고갈되었다ㅠㅠ 어서 카메라를 장만해야겠다. 핸드폰 밖에 없으니 올리기도 참 민망;;; 이제 방문자수도 명이 훌쩍넘는데 사진이라도 제대로 올려야 유지할 수 있을 것 같다.
275,"저는 일을 하다가 창의적인 아이디어가 떠오르지 않을때 멍때리기를 합니다. 생각을 비워내는거죠. 머릿속에 있던 좋지 않은 아이디어를 지우고, 새로운 아이디어가 떠오르는 좋은 방법인 것 같습니다. 지워내지... "
276,아이디어가 고갈된 디자이너를 위한 책 저자 스티븐 헬러게일 앤더슨 출판 더숲 발매 ... 좋은 디자인을 보며 내가 가지고 있는 아이디어를 어떻게 표현하는 것이 효과를 극대화 할 수 있는지 생각해... 
277,집구석에 빵도서랍속에 과자도머릿속에 아이디어도사이좋게매진...ㄷㄷㄷ....ㅠ_ㅠ
278,"세계적인 거장 인에게 배우는 효과적인 일러스트레이션 아이디어 총 권의 시리즈가 있다. 책 속으로 일러스트레이션은 일정한 교육을 받으면 충분히 배울 수 있는 분야이지만, 시각적인 아이디어로... "
279,일간의 외출을 끝내고 드디어 집에서 뒹굴댔음 햄벆... 호리미야 지금 첨 봤는데 나중에 미야무라 머리 자른다는 스포(?) 밟고 우울해짐 화보고 벌써 과몰입 완료 ㅎ 시발.. 머리 왜 자르는데 미친놈아ㅠ... 
280,"‘달인’ 김병만, “아이디어 고갈? 아직 무궁무진”:clipoard_copy(document.location.href);&gt; 기사입력 -- :: [OSEN=김국화 기자]개월 동안 방송된 KBS TV ‘개그콘서트’의 장수 코너, 개그맨들도 손꼽아... "
281,블로그를 꾸미고 엘소 글 올려야하는데.. 아이디어 고갈되버렷다니..(허접해 ㅜㅜ) 누가 아이디어좀..
282,"아이디어가 너무 기발하여, 한장 남겼다. 비닐봉지가 밭에 튀어 나와있는걸 보곤, 아이가 그런다. &quot;엄마, 저 풀은 이름이 뭐예요?&quot; 이야. 아이디어, 최고!!! 난 요즘, 끌려가고 있는 중. 어쩌나. 어쩌나. 매출은... "
283,머를 만들든 아이디어가 생각 이안나군 봉황도 불이져? 불타입?인걸로아는디 전 집어늘 능력좀 아이디어 부탁 개만 말하삼
284,아이디어가 고갈되었을때 PART  -  어떤 일을 하든지 번뜩번뜩 새로운 아이디어가 떠오른다면 당신은 어떤 분야에서든 최고가 될수 있을것이다. 하지만 누구나 아이디어가 고갈되는 시기가 있기마련입니다.... 
285,매일매일 디자인을 하는 나에게 로고디자인은 디자인을 배우면서부터 늘 고민하는 것 중의 하나였다. 기업의 Identity를 나타내는 로고디자인은 단순해보이지만 결코 만만하지는 않은 작업이다. 이번에 이... 
286,"각종 먹거리를 섭렵하며 프로그램의 인기를 견인해온 출연자임을 감안하더라도 별 다른 고민 없이 예전에 해왔던 수단을 다시 활용하는 건 아이디어의 고갈, 결핍이라 봐도 무방하지 않을까? 이렇다보니 심혈을... "
287,특히 말주변.. 제가 생각할때에도 아이디어를 얻으려면 어떻게 해야할까 고민을 많이 하는 편이기두 하구요.. 중요한 점은 영상편집할때 아이디어는 매우 직관적인 방법으로 적용이 되거든요..;
288,꼭 해야하는 건 아니지만 뮈할지 주제추천 받아요
289,아이디어가 고갈되었을때 마지막입니다.  . 예상하지 못할 만한 것들을 기대하라. 순간순간 우리 눈앞에 스쳐지나가는 것들이 있습니다. 이런 일들을 캐취하는것도 능력이라고 생각되네요. 광고천재... 
290,아이디어 추천 받습니다 혹시 평소에 필요했던 스크립트나 만들어보고 싶었던 스크립트가 있다면 댓글을 남겨주시거나 https:open.kakao.comogzsQkIc 또는 pvwvq#로 연락주세요
291,
292,zarnes님 저도 이제 아이디어가 고갈났어요ㅠ 배경을 좋게는 만들었는데 장애물을ㅠ
293,뇌를 안쓴지 너무 오래돼서 아이디어가 떠오르지 않는 돌 머리가 되어버렸어요 머리가 굳는 다는 느낌이 이런 느낌인지 지금에서야 깨닫는 중이에요 친구들이나 주변 사람들 보면 다들 어렸을 때 공부 열심히... 
294,오늘일기를 깜박할 뻔 했다. 아까까지는 기억하고 있었는데 순간 잊어버렸다. 알려줘서 고마웡~! 늘 똑같은 일상을 반복하다보니 어떤 일기를 써야할지 모르겠다. 어떤 일기를 썼으면 좋겠는지 이웃분들 댓글... 
