,0
466,"회의 시간에 아이디어를 내는 것도 귀찮고, 퇴근 후 술자리에서도 맨날 똑같은 이야기 뿐이다. TV에서... 제때제때 적절히 대처하지 않으면 끊임없는 권태와 결핍 속에서 마음은 고갈되고 몸은 녹초가 될... "
467,날 너무 힘들게 했어 이 책을 읽어야 하는 분들 아이디어 회의 시간에 꿀 먹은 벙어리로 앉아 있는 분... 창의력이 고갈되었다고 느끼는 직장인 그렇담 내가 읽어야지!! 그럼그럼 하고 집어 들었다가 꽤 오랜시간... 
468,"년 연재에도 아이디어 고갈 없는 &lt;트라우마&gt; 이야기가 이어지는 것도 아니고, 특별히 주인공이라고 할... 작가는 아이디어를 어떻게 얻을까. “웹툰을 그리는 동료 작가들과 일주일에 한 번씩 아이디어 회의를... "
469,"화상회의가 비대면의 시작은 아니지만 이로 인해 사무실,학교, 도시,인간생활 등을 생각하게 된다... 들기,갈아입기는 아이디어가 막힐때 탄력을 받아 풀릴 수 있다 상상의 날개를 펼쳐라 ㆍ인간의 샹상력은... "
470,"사업 기획 회의에 함께 참여해서 의견을 내기도 하고요. 외주를 맡겨야 해서 업체와 소통하기도 하고... 최예슬 YP 영어실력도 필요하고, 홍보를 담당할 때 아이디어가 많으면 좋겠어요. 소재가 고갈되거든요..... "
471,미션기획하면서 많이 리젝도 당하고 아이디어 고갈도 많이 느꼈지만 고생한만큼 정말 보람을 느낀... 파이널TFT 오티 이후로부터 계속 일차 오전미션 기획에 배정되어서 아이디어 회의도 많이 했었거든요.... 
472,따라서 친한 사람들끼리 아이디어 회의를 통해 코너를 구성하는 경우가 많다. 일단 코너를 짜면... 아이템이 점점 고갈되고 있다는 평을 받고 있다. - 정치 풍자의 측면 : 시즌에 들어 ‘여의도 텔레토비’는... 
473,"[No ,] 은하패트롤 쟈코 특별판 슈퍼엘리트 ver. (쟈코 포스트카드,쟈코 키 홀더,슈퍼 엘리트 배지) JACO THE GALACTIC PATROLMAN -Special Edition- (년)  토리야마 아키라 (Akira Toriyama,とりやま あきら... "
474,어떤 아이디어가 나왔을까요 !! 차회의는 조용한 스터디룸에서 진행되었습니다. 영원이한테 혼나는 두... ㅋㅋㅋㅋㅋㅋㅋㅋㅋㅋㅋㅋㅋ 많이 더웠죠 우쭈쭈ㅠㅠ 재료가 고갈되는 멘붕의 상황도 있었지만 그래도... 
475,(금) 매달 셋째주 금요일 시에 있는 회의가 코로나 확진자 때문에 취소됐다 예에에에에 너무 신나서... 너무 열심이 놀아서 체력 고갈... 생양파보다는 훨씬 더 익혀서 달달하게 먹었더니 맛있다... .(일)... 
476,메인은 웹툰 작업이에요.(@coon_funny) 한 달에 -번 진행하는 콘티 회의 결과를 기반으로 웹툰을... ^^* 혹시 뭘 만들어야 할지 아이디어가 고갈되시면 저에게 꼭 도움 요청해 주세요. 제가 먹고 싶은 거 아이디어... 
477,이 회의의 목적은 지구를 환경파괴로부터 보호하고 천연자원이 고갈되지 않도록 국제적인 협력체제를... 놀라운 아이디어와 창의력에 많이 놀랐습니다. 이틀간의 부스운영이라 조금은 힘들기도 했지만 많은... 
478,번아웃 증후군이란 일에 몰두하던 사람이 극도의 피로감으로 인해 무기력하며 에너지가 고갈된... 충분한 휴식과 집중을 반복한 개인은 신선한 아이디어와 문제에 대한 새로운 접근 방법을 도출할 가능성을... 
479,때마침 년초인지라 우리 회사도 경영전략을 세우고 전략평가회의를 실시하고 있다. 회의를 마치고... 있는 아이디어를 친절히 제공하고 있다. 충분히 실전에 고려해 볼만한 내용들이다. 이 책에는 내가... 
480,"비엔나에서 열린 나폴레옹 전쟁 전후 처리를 위한 세계 최초의 국제회의인 비엔나 체제()의... 혹자는 , 악장을 작곡해놓고 추가 작업을 잊어버려서라고 하고, 아이디어 고갈로 스톱했다는 설도... "
481,"요즘 스터디 친목과 팀플회의 등으로 단톡방 개 정도가 거의 매일 움직인다. 그 중 가장 부지런히... 순수한 사심들로 기쁘게 준비하는 자리, 설렘과 즐거움이 반짝반짝거리는 아이디어와 농담들이 네모난... "
482,무려 일 전에 회의함! 매번 파티 ~일 전 다급히 준비하다가...ㅋㅋㅋㅋㅋㅋ 그래서 그런가 이번에는... 걸려서 아이디어도 고갈되고 해서 그냥 말로 뱉은걸 그렸다. 번째는 '소스'를 내뱉은 점씨의 볼따구... 
483,(클릭 - 이미지 확대) 수십 년에 걸쳐 실행된 몇 가지 아이디어는 다음과 같다. • 상수도에 포함된 불임... 인구 정리 어젠다는 안정적이고 기능적인 사회의 기반이었던 모든 전통적인 제도들을 허물 것을... 
484,"현재 생태계는 빠른 인구성장과 경제발전 때문에 고갈되고, 되돌릴 수 없는 상태에 이르렀는데요.... 기술, 아이디어, 해결책을 소개할 예정이라고 합니다. ◈ 세계환경의날에 할 수 있는 일! 이렇게 수십... "
485,"지금까진 대부분 책읽기, 글쓰기 주 회씩 온오프라인 모이으로 랜선 회의나 아침을 함께 먹기도 한다.... 아이디어도 마구 쏟아지는 기분. 그동안 에너지 관리가 너무 안되서 에너지 고갈되는 기분 집에만 있고... "
486,이는 년 UN의 장애인생활환경 전문가 회의에서 ‘장애인 접근성을 위한 배리어프리 디자인(Barrier... 의자)를 아이디어로 낸 것이 전국적으로 확대되기도 하였다. ‘장수의자’의 정책사례처럼 무단횡단을... 
487,"떠오르는 아이디어와 생각을 후속 그룹으로 되돌릴 수 있었습니다 우리는 널리 받아들여지는 관행에... 자원이 고갈되어 있으며, 우리가 다루는 다른 모든 의료 문제와 마찬가지로 우리가 원하는대로 심부전을... "
488,아이디어가 샘솟는 회의하기 . 미루는 일 없애기 &lt;서문&gt;자가 진단표 (많을수록 문제가 많은 것임)... &lt;&gt; 아침에 출근하자마자 회의를 여는 것은 모든 사람들의 생산성을 고갈시키는 행위다. 사람들은 오전... 
489,"&quot;아이디어 고갈이 심했던 게 사실이었고, 기존의 방식으론 만들 수 없겠다는 생각을 했습니다.... &quot;프리 프로덕션 단계에서 재미를 위해 회의를 많이 합니다. 아이디어를 얻기 위해 라바가 사는 하수도를 하루... "
490,"보고, 아이디어 회의도 했어요. 요즘은 스케줄 하느라 그렇게 많이 찾아볼 시간이 없어서 답답해요. 확실히 고갈되고 있다는 생각도 들고요.”(화사) ‘불후의 명곡’의 커버 무대도 직접 기획했다. “‘불후의... "
491,관심을 보인 책을 미리 선택을 했어요!!최근에 가족회의를 하고 나서!!아이들이 좋아하는 활동을... 최근에 실험시간을 뚱이와 뭉치가 원해서!!아이디어 고갈될때 하나씩 풀 보물상자랍니다..ㅋㅋ 개의... 
492,많은 회의를 느꼈다. 그러한 이유들로 인해 그는 물리 과학자의 일을 버리고 평생 자전거 개발에 몰두하게 된다. 석유의 고갈을 예감한 데이비드는 당장 자동차를 대신할 자전거 개발에 힘을 쏟지만... 
493,하면 고갈됐던 정신 에너지가 재충전된다. 경이로운 자연의 아름다움을 눈으로 보고 느낄 경우 뇌가... 따라서 중요한 아이디어 회의를 앞두고 공원을 산책할 경우 많은 도움이 된다는 것이다. . 더 큰 행복감을... 
494,"특히, 회의시간이 오바해서 점심시간을 일부 빼앗아간 경우나 긴급한 업무가 발생해 점심시간에도... 일하다 스트레스 많이 받거나 아이디어가 고갈되었을때 한번씩 오는 곳...그런 경우는 많은데 시간관계상... "
495,에너지가 고갈되는 게 눈에 보인다. 그러다가 놀이터에서 시간 동안 놀면 집에 와서 지쳐서 쉬는 게... 굿 아이디어이십니다. 사장님 만세 만세 만만세!' ENTP식 고도의 사회화가 되었지롱. # 돈을 본 게... 
496,ㅋㅋㅋㅋㅋㅋㅋㅋㅋ 오늘은 무엇을 포스팅 해볼까 하다가 저희가 저번에 아이디어 회의를 잠깐... ㅋ 눈물을 머금고 올리겠어용 ㅠ ㅋㅋㅋㅋㅋ에휴 여튼 아이디어 고갈에 힘들어하던 저희에게 힘을 주는... 
497,"실천 아이디어를 몇 가지 갖고 있다. 이를테면 숙면하기 위해 일정 시간이 되면 전자기기 전원을 끄거나 잠자리에 들기 분 전에 알람이 울리도록 설정하기, 활동량을 늘리기 위해 동료에게 걷기 회의 제안하기... "
498,"SkyHoroscope 양자리 내면의 힘, 자발적인 에너지, 자신감 월은 양자리의 삶에 많은 용기와 에너지를 가져다 줄 것입니다. 이 기간 동안 당신은 아무 걱정도 하지 않을 것이기 때문에, 모든 것이 순조롭게 진행될... "
499,연례 회의에 예정된 연사 입니다. Goodyear는 산부인과 의사이자 골반저 외과 의사로 시작했습니다.... 그것은 실제로 그것을 만드는 특정 중간체의 신체를 고갈시키므로 설탕에 중독된 이 암은 에너지(ATP)... 
500,"[No ] 은하패트롤 쟈코 특별판 (한정부록 : 엽서 + 키홀더 + 배지) JACO THE GALACTIC PATROLMAN (년)  토리야마 아키라 (Akira Toriyama,とりやま あきら,鳥山明) 저  정은서 옮김  (주)서울문화사 (C .. C... "
501,이 시간동안 뇌가 중립상태가 되어야 아이디어가 떠오르고 기억이 정리가 되고 창조성이 살아나서... 일에 집중하려 해도 각종 회의에 불쑥불쑥 새롭게 생겨나는 일들이 생긴다. 게다가 혼자 하는 일이... 
502,"활동 내용: SNS 마케팅 및 아이디어 회의, 마케팅 프로젝트 기획 및 실행 달에 번 오프라인 정기... 흐..저는 아이디어가 고갈된 요즘이라.. 참여하실 분들은 지원해보세요!!! 빅버드"
503,"기본 지키기를 강조하며 회의와 회식 문화 개선, 복장 간소화, 칭찬과 인정하기, 퇴근 시간, 눈치... 중지된 이유는 아이디어 고갈로 수준 낮은 경영제언 발표, 구성원의 불만 불평 대변, 청년중역은 개월이지만... "
504,독일 상공회의소 협회(DIHK)에 따르면 점점 더 많은 독일 기업이 시장에서 에너지를 공급받을 수 없으며 에너지가 고갈되면 독일 경제는 단순히 작동을 멈춥니다. https:rmx.newsarticlewithout-energy-no... 
505,"밤 회의에서 다음날 할 프로그램을 계속해서 수정하고 다시 짜고, 또 우리가 개반으로 로테이션 하면서... 막내야팀 아이디어 고갈된다며 엄청 힘들어하기도했다 ㅋㅋㅋㅋ 근데 누가 시켰냐고!ㅋㅋㅋㅋ 진짜... "
506,환경( E) 사회(S) 지배구조(G) • 기후변화 • 자원고갈 • 물 • 공해 • 삼림파괴 • 인권 • 현대... 새로운 아이디어나 방향성을 제시할 수 있는데 큰 도움이 되기 때문입니다.) 그렇다면 ESG는 왜... 
507,"(화상회의) ｢탄소중립 산업‧에너지 R&amp;D 전략｣ 발표(., 산업부) ◆ ‘년 NDC’ 달성 및 ‘년... 창업아이디어 경지대회 우수작(팀) 등 총 팀 시상, 우수 연구성과물(개) 전시·시연 ◆ 디지털... "
508,"보이스톡으로 회의를 하며 아이디어를 구상했고, 내용 배치에 대해 이야기했구요. 마지막 날 카페에서... 석유는 고갈되고 식량을 언제까지 수입할 수는 없으니까요. 아랍에미리트에 만달러 규모 수출계약을... "
509,"첫째, 고성과 팀의 구성원들은 회의 중 고르게 아이디어, 해결책, 생각, 계획 등을 공유했다. 둘째, 고성과 팀의 구성원들은 모두 비언어적 신호를 바탕으로 다른 사람의 기분을 파악하는 능력이 뛰어났다(쪽)... "
510,소망교회.영남) 정권'이란 역풍으로 취임 일 지지도가 % 국정 동력의 조기 고갈이었다. ). 첫 과반... 대 통령 직속의 개 정책별 위원회(Cainet Councils) 로는 내각보다 호흡이 긴 중장기 정책의 아이디어를... 
511,"잘만든 회의 PPT, 회사 제안서 PPT 너무너무 중요하죠. 하지만 이걸로 일주일 이상 쩔쩔매고 있으면... 저는 전문디자이너가 아니기 때문에 PPT를 만들다보면 디자인 아이디어가 고갈되고는 하는데 여기서 많은... "
512,생각보다 카드뉴스 주제를 선정하고 디자인 아이디어를 내는 데 꽤 오랜 시간이 들어요. 콘제팀 정기 회의 때마다 떠오르는 것들을 마구 말하다보면 괜찮은 아이디어가 나오더라고요! 우리 팀원들이 붙여준... 
513,점 바비 코틱 % 시리즈 제품에는 성공적이나 인재 고갈의 위험이 있다 단점 - 마진 짜내기가 최우선.... 작은 회사라면 많이 실험해볼 수 있는 혁명적인 아이디어라도 여기서는 몇 개월의 승인과 문서화... 
514,"사람이 아이디어를 도출해내는 회의로 글쓰기, 프로젝트 수업, 기업 회의, 등 다양한 방면에서... 동반 상승효과 자신의 아이디어가 고갈되었다고 그냥 가만히 있는 것은 바람직하지 않습니다. 즉... "
515,그리거 다음 날 학교 근처 카페가서 광고 회의했다 ㅠㅠㅠㅠㅠㅠㅠㅠ 아이디어 고갈 왕복 시간 통학은 쫌 힘드네 이날 오후 수업 끝나고 집 가려는데 라온이랑 급 호캉스 ❤️ㅋㅋㅋ 피자는 식었지만 사진은... 
516,"세이지는 새로운 도전에 대한 영감이 솟을 때, 그러니까 도전을 실행할 아이디어가 떠오를 때면 생각을... ★★★ ----- &quot;꿈을 위해 죽을 준비가 안 되었다면 꿈을 위해 살 준비도 안 된 것이다.&quot; 기회의 문은... "
517,간부회의 명 정도 모임을 하는데 오셔서 자기소개 하라고 하더라구요 그래서 준비하고 면접을... 그런데도 연락이 없더라구요 그래도 끝까지 할까 생각도 해보았는데 더 이상 아이디어 고갈이었습니다. 더... 
518,누구 아이디어야 끼양~~~오랜만에 같이 사진남겨서 ㅎㅂㅎㄷ 김은서 예쁘네… 칠리새우랑 소세지랑... 제주도 회의하고  모니터링 평가지 보내고나니 에너지 고갈돼서 누워버렸다 내일을 위해 잔다 안녕-!
519,"철우는 원색 옷을 참 좋아해요;- 훈남팀장 철우의 고뇌하는 모습이 보여요, 회의는 점점 무르 익어요. 배가고프고 아이 그래서 사진이 참 잘 받는거 같아요. 우리 두 팀장님들 화이팅 ˙-˙) 디어가 고갈이 될... "
520, 앵글로색슨 협회의 연회장 앵글로색슨족 연회장은 초기 영국 사회의 중심에 있었다. 이는 베오울프같은 영웅시에서도 등장한다. 영국에서는 연회장의 일부가 유적으로 발굴되었다. Yeavering의... 
521,"지식의 고갈에 대한 의문을 품기 시작하였음. 로머의 지식생산함수에 대한 회의 dA=G(La,A) 지난 년간... (더 높은 수준의 지식 역시 대체됨) 지식생산함수역시 수확체감하였음: 발견하기 쉬운 아이디어를... "
522,"챔피언을 만드는 것은 파워가 아니라 효율성이라는 그의 아이디어를 널리 퍼뜨렸다. 클림과 포포프는... 당신의 힘은 곧 고갈될 것이다. 그는 네덜란드 그로닝겐 대학교의 동물학자 죤 비델러가 쓴, 그가... "
523,"기회의 빚을 갚지 못했다면, 소소하게 일어나는 일상에서는 기회를 삼번 속에서 다시 심기일전 할 수... 그래서 지식인이 아이디어를 내고 부자가 가진 경제를 다시 투자하여 새로운 동력을 만들어, 어려움... "
524,"매주 토요일은, 르데뷰 회의가 있다. 매번 호가 끝나면 우리는 다음호 주제에 대한 브레인스토밍을... 다시 아이디어 고갈 상태에 이르렀다. 조금 휴식기간을 가지고 더 연구 해봐야 될듯하다. 아직 다른... "
525,첫날은 오전에는 회의를 하고 오후에는 교육을 들었는데 교육이 너무 힘들었다.. 너무 피곤한데... 아이디어가 고갈되서 문제였다 또 아침에 담당자 팀장님이 주신 과제도 해결하고 힘들었다.. 힘이 들어... 
526,온라인입점을위한 아이디어회의 비누주문받기 배송하기 등등등 멘붕멘붕 이 외에 언급되지 않은... 물론 뽀모도로로 업무보거나 잡일을 세분화하여 집중하여하면 생각보다 에너지고갈현상이... 
527,(아이디어 킬러 포스터)에는 회의 중에 한마디로 상대방의 아이디어를 죽여버리는 훌륭한(?) 대사들이... 그러나 공식에만 매달리는 사람은 서른살도 되기 전에 창의력이 고갈해 버립니다. 자기만족에 빠지면... 
528,"는 점이 화애락 이너제틱의 독특한 특징이었고, 월 정기회의때 BM님께서 제품설명을 하며 강조하신... 크흡 이번달은 벌써부터 아이디어가 고갈되어가는게 느껴져서 좀 힘들었다. ㅠㅠ다음 달에는 전달하고자... "
529,"사진이나 찍자 &gt;,&lt; 저의 영롱한 노트북이 보이시나욯 (회의하다가 영감이 떠오르지 않자 사진부터 찍는 우리들.jpeg) 배는 고프고 아이디어는 안나우고... 에너지가 고갈된 우리! 점심을 먹으러 고고 &gt;,&lt; 그날따라... "
530,"(남친도 공대생이고, 저도 프로그래밍 조금 다루거든요;) 그래봐야 현청와대는 아이디어 고갈났다는... 편익비용 분석이 필요할진대, 저는 회의적입니다. &quot;봉하마을&quot;에서는 전용선을 설치하면, 대통령과... "
531,"방긋이 얘기를 듣다보니 수업 아이디어도 떠오르고 방긋이의 학교생활을 알 수 있고 좋아요. 이날은... 밤만되면 체력고갈 되더라구요. 학년되니 학교에서 받아쓰기도 매주 시험보고, 매주 글쓰기, 독서록씩... "
532,매월 일이 되면 저는 아이디어 고갈사태에 처하게 됩니다. 왜냐하면 일은 바로 아이디어 제안서... 매달 초가 되면 OP인들은 회의실에 모여 다같이 게임을 하거나 두근두근 제비뽑기를 하곤 하는데요! 그... 
533,"체력 고갈 이유가 어제 공복에 과다 섭취한 카페인과 무더위 때문인지 알았는데, 이제 한번 리셋하고... 보니, 아이디어와 창업의지만 있으면 기회가 열려있습니다. 그리고 우리나라는 선진국에서도 최고로 창업... "
534,"금융시장은 지정학적 위험으로 연준이 월에 금리를 p인상할 가능성에 무게를 두고, 월 회의에... 혁신적인 아이디어가 논의되고 구현되는 곳이라고 설명했습니다. 테슬라의 제품 관리부 직원의... "
535,새로운 아이디어와 제품을 위해 비즈니스를 발전시키는 방법에 대한 큰 그림 회의에 참석하십시오.... 그러나 그들은 더 큰 이익을 위해 자신의 필요나 이익을 잊어버리는 경향이 있으며 고갈될 위험이... 
536,당신의 직관을 신뢰하는 것은 건전한 정도의 회의로 완화되어야 한다. 새로운 과제이기 때문에 과제를 설명할 수 없습니까? 아니면 진실의 전모가 당신에게서 가려졌기 때문인가요? 누가 비밀을 지키고... 
537,"인생이 재미없게 느껴지거나, 머리를 잠깐 식히고 싶을 때, 아이디어가 고갈되었을 때, 등등 가볍게 휙휙 보기에 좋다! 가볍게 보기 시작하면서도 깊은 영감을 선물해주기도 한다. &lt;&lt;별게 다 영감&gt;&gt; 이라는... "
538,"히히 저 날은 코.검 땜에 일찍 깨서 화장도 제대로 했네 도시락 메뉴 아이디어 고갈돼서 떡뽀끼 시켜먹었당 흐음 존맛탱굴이,,, 떡볶이는 무족권 컵밥같은 거랑 같이 먹어야 함요 한국인은 밥!심! 글고 윤범이가... "
539,"산학 조별 회의 중 아이디어 고갈에 쓰러진 내 머리위에 영짱이 탑 쌓기 놀이를 시작해따 아아~! 영쨩구 어린이~! 어제 우리 예쁜 뽀 생일 파티여ㄸㅏ 원래는 월 일 생일이ㄴ데 장보고 때문에 늦게 마쳤고.,.!... "
540,회의하다가 갑자기 내 카메라가 켜져버려서... 진짜너무수치스러웠음진짜세상에이런일이 ㅋㅋ... 다 고갈됐나바... 도토리 사진 올려줌... 잘 지내니? 보고 싶다... 아이디어 안 나오는데 자꾸 쥐어짜내야 해서... 
541,S기자단 와파이의 보람① : 멋지고 좋은 아이디어가 나왔을 때의 뿌듯함 아이디어 고갈로 인해 회의 분위기도 싸늘해지고 힘만 빠지는 가운데 갑자기 떠오른 멋진 아이디어를 팀원들 모두가 칭찬해줄 때의... 
542,"∘ 나는 회의 중에 아이디어가 떠오를 때, 모두에게 공로가 있으므로 모두가 인정받아야 한다고... 아니면 사랑의 샘이 고갈된다고 생각하는가? ∘ 나는 다른 사람이 세상을 나와 다르게 볼 수도 있고, 그들이... "
543,가짜 실패에 유의하라 부정적 결과가 나온 것은 아이디어 자체의 흠결인가 테스트 과정상의 흠결인가?... **정신 인간이 불멸인 이유는 생명체 중에서 유일하게 고갈되지 않는 목소리를 가졌기 때문이 아니라... 
544,좋은 아이디어 모바일세대_는 이해하기 쉽지 않은 감성 요-거 '선물' 받고 싶움 색깔 종류별로 다- 갖고... 체력이 고갈 되고 말았다. 그래도 찾았음 문이 닫혀있었지만 찾아냈음!!! 제비다방_을 떠오르게 했던... 
545,"스스로 아이디어 고갈에 빠질 가능성이 높지만, 투자 심사역이 다양한 업체를 검토하면서 이해하고... 회의 연재에서 언급한 많은 내용들이 일종의 자가 체크리스트로서 창업자스타트업이 스스로를... "
546,스와미나탄 박사는 로이터즈 넥스트(Reuters NEXT) 회의 에서 남아프리카 공화국의 데이터를... 설문 응답자의 %만이 아이디어를 지지했다. 또 다른 제안은 아직 국내외에서 논란의 여지가 있다. 당은... 
547,월 일 (화) 이 날은 동기들이랑 광고스토리보드에 대해서 회의한날!! 하나도 아닌 둘도 아닌 셋이라서... 쓰는데 아이디어는 고갈이고 당은 떨어져서 옆 부서 탕비실에서 아이스티인줄알고 훔쳐온 립톤은 그냥... 
548,"“역사상 어떤 순간에도 리스크를 감수하지 않는 사람들, 즉 개인적으로 리스크에 노출되지 않는 사람들이 지금처럼 커다란 권력을 행사한 적은 없다.” p. “안티프래질를 이해하면서 역사, 기술, 지식과... "
549,스타벅스에서 회의를 진행했습니다. 우선 주어진 가지 주제 중  step은 영상 내용이 너무 뻔할 것 같아서 젤 vs 크림을 하기로 했어요! 그리고 반짝이는 아이디어를 찾아헤매던 중... 다들 아이디어가 고갈되... 
550,"&quot; 긴급이라는 말을 듣고 자기들끼리 회의를 시작한 그들을 보며 S.G는 비꼬았다. &quot; 자기들만의 세상에... 더 쓰고 싶었는데, 이번화에서 쓸 아이디어가 고갈 되었다. • 다음화는.. 언제 나올지 모르겠다. 아직 도... "
551,"구체적인 컨셉, 디자인, 곡 레퍼런스, 영상, 홍보 등 모든 프로세스를 분업과 팀워크로 해내야 하는 대형 프로젝트라 매주 번 이상의 아이디어 회의를 해서 머리가 터질 지경...아이디어 고갈 상태...^ㅠ^ .... 나의... "
552,그래서 엔지니어들이 매일 하는 스탠드업 회의에 초대해달고 했다. 그 회의에서 내가 도울 수 있는... 스타트업과 아마존) () .. [리뷰] 아이디어가 고갈된 디자이너를 위한 책 (그래픽 디자인편) ()... 
553,"제안을 해도 자꾸 무시당하니 시간이 지날수록 아이디어가 고갈되고 마는 거다. 하지만 해멀 교수... 년 학계에 발을 들인 그는 정형화된 방법론, 연구 외적인 것에 치중하는 학계 풍토에 회의를 품고 직접... "
554,"일정을 잡거나 계획하기 힘든 존재이며, 따라서 온라인 '혁신 회의'를 조직하는 것은 혁신과 창의성을... 의사 소통이 단절되고 아이디어가 고갈된 느낌이 마련하게 된다. 이는 분명히 장기적으로 비즈니스에... "
555,ㅋㅋㅋㅋㅋㅋㅋㅋㅋㅋㅋ 그래서 내 자리엔 앉아보지도 못하고 회의실에서 바로 회의했다 ㅋㅋㅋ... 실제로 아이디어가 고갈됐을때...다들 라운지에 나와서 참고를 많이 하시는 것 같았다 ㅋㅋㅋㅋ 그리고... 
556,메뉴 아이디어가 고갈되더라구요... 주부 이웃님들 저만 그런거 아니죠?ㅎㅎ 이번에는 새로운... 와사비와 간장과 새우회의 조합이 정말 쫄깃하고 맛나더라구요. 요기 단새우는 급속냉동을 해서 더욱더... 
557,"제회 야마부키 베이커리 신작 회의를 열게 된 멤버들이었는데, 말장난이 가득한 빵부터 잠차 옷이라던가 이상한 쪽으로 흘러가고 말았다. 결국 아이디어가 고갈돼서 멤버들이 지쳤을 때 카스미는 포핀빵을... "
558,"산관학 공동 프로젝트 아이디어 중 하나이다. 쓸모있는 어업으로 연결하려는 의도가 있다. ▲ 이에 관심을 보이는 곳이, 아프리카 국가라는 것. 포르투갈에서 최근 개최된 유엔해양회의 행사에서... "
