,0
522,"스티치가 제한되다 보니 조합이 쉽지 않아 보통 앞부분에 정성이 들어가고 뒷부분에서 아이디어 고갈로 겨우 마무리하는듯한 느낌이 드는데, 수강생님은 오히려 뒤로 갈수록 아이디어가 번득이는듯 해서... "
523,전문 크리에이터가 되기로 결심하고 나서부터 가장 고민되는 부분이 바로 '콘텐츠 고갈'에 대한... 주변에 모든 것들이 아이디어요 소재.. 하지만 역시 최고의 영감원은 변함없이 책이다 플라폼 건축연구소 책... 
524,ㅋㅋㅋㅋㅋㅋ 그래서 가끔 친구나 연인과 함께 인생네컷을 찍으러 가게 되는데요 몇 번 찍으니 아이디어도 고갈되고 어떻게 찍어야 할지 고민이 많더라고요? 그래서 참고하기 좋은 다양한 인생네컷 포즈를... 
525,중국의 흔한 언플기사 내용; 이 드라마는 남아공에서도 인기가 상속자들을 넘어섰다는군요. 이젠 남주인공의 인기도 남아공에서는 이민호를 넘었다고 봐야겠지요. 풉!미쳤는가? 상속자들의 드라마팬이 나도... 
526,"금방 아이디어 고갈- 뭘 만들어줘야 할지,, 다양한 식재료를 섞어가며 만들어주면 참 좋은데 정말 쉽지 않더라구요 그러다 만난 배냇밀 이유식은 정말이지 몇일동안 행복했어요 한우콜리플라워진밥... "
527,과연 아이디어를 떠올리는 데 노하우가 있을까요?광고인이 되고자하는 사람들이라면 누구나 한번쯤 고민하는 그것바로 아이디어의 고갈! 이 책에서는 바로 그 아이디어를 깨우는 방법을 가르쳐줍니다.단계별로... 
528,아이디어가 고갈된 백성에게 관대한 미소를 짓어주고 계신 유자 님.JPG 미소 말고 진짜 아이디어가 필요합니다요-!! 물론 저 얼굴만 보고 있어도 스트레스와 긴장이 스르륵~ 풀리는 효과가 있긴 합니다... 
529,"대안이 생각나지 않을 때, 아이디어가 고갈되었을때도 이런 방식으로 한번 접근해 봐야겠다는 생각이 들었다. 바로 써먹을 수 있는 새로운 방법론을 알게 되었다. → 프리토타이핑 기법은여러번 반복하는 것이... "
530,월은 챌린지 쉬려고 합니다 아이디어 고갈 ㅎㅎ 하지만 짠테크는 멈추지 않아요 저것들 대부분 돈은 쓰지 않고 구매 했습니다 딱 원 썼네요 나머지는 포인크 캐시백 네이버페이 등등 지금도 뭔가 먹고... 
531,괴담 연구소 아이디어좀... (이래도 않달아 이 눈팅족 때문에 ) 덧글과 공감은 필수!
532,"그러나, 갑자기 이 자아의 고갈이라는 아이디어는 모래 위에 새겨진 헛소리처럼 보입니다. 이는 이 몇몇 과학자들의 경력의 상당수를 포함한 이 분야 전체의 연구가 잘못된 가설 위에 서 있었음을 의미합니다.... "
533,이제 일기를 대충 써도 되는건 맞지만 아예 쓸 제목이 없으면 막막하다. 그런데! 나는 그 상태에 처해있다!!!!!!!!! ヽ((◎д◎))ゝ 으악!!!!!!!!!!!!!!!!!!!!! (사실 이게 대충 쓰는거지 뭐 ㅎ 글 크기 키우는 것 봐... 
534,저의 고갈직전의 아이디어에 영감을 불어넣을 이웃님들의 아이디어를 들려주세요!! 입니다+_+ 참여하시는 방법은 . 이웃 한정 이벤트이니만큼 이웃이 아닌 분들은 이웃추가 해주세요^-^ . 자신의... 
535,많다 마너 아이디어 고갈 ㅠ 빛번짐차이 ㄷ ㄷ 쩔죵 아이폰 카메라 빛번찜 쩔어서 찾아보니까 카메라를 닦으면 된다길래 해보니 진짜 효과 짱...!! 요긴느 달콤커피 사라지고 생긴건데 일케 감성카페일줄은... 
536,자체적인 서비스 개발 아이디어를 찾기 보다는 외부에서 성장동력을 끌어모으고자 하는 방향입니다.
537,배경이 그래서 더 많이 그리고 싶었는데 아이디어 고갈 능력 부족... 그래두 좋은 경험이었따... 난 이게 유독 맴에 드네! 영어를 못하는 이모는 네이버 검색을 오지게 했다는 후문이... ㅋㅋㅋㅋㅋㅋㅋㅋㅋ 결국... 
538,"아이디어 고갈 현상이 일어나기 시작하고!! 몇개 안되는 아이디어와 아이템을 다써버린 지금, 더 새로운것, 지난번보다 더 진일보된 그러한 뭔가를 찾기는 여간 어렵지 않거든요. #대여자친구생일선물... "
539,(토) ▣ 공모주제 미래사회문제를 과학기술로 해결할 수 있는 아이디어 · 에너지 및 자원 고갈 · 기후변화 및 자연재해 · 해양 폐기물 및 해양 오염 ▣ 참가대상 전국 중·고등학교에... 
540,ㄹㅇ 아무데나 가둬두고 똥마렵게 하면 꿀잼 에피소드 탄생
541,이라는 숫자를 보면 약간 심리적으로 아이디어가 고갈이 된다는 느낌을 가진다. 노인분들이 나이가 점점 먹어가면서 자신의 신체적 정신적 한계를 느끼는 것처럼 게시물의 수가 늘어나면서 나도 이런 비슷한... 
542,암 생각없이 찍다가 아이디어 고갈로 바닥에 떨어진 (누군가 뽑아버린 것 같은) 귀리 들고 찍어줬습니다 제법 욱겨요 사진까지 야무지게 찍고 나와줍니다 다른 블로그에서는 내부에 앉을 자리가 없다고해서... 
543,'아이디어가 고갈됐다' 싶을떄 이용하면 좋다. 다른이의 책을 훑어 보면서 생각을 약간 비틀어 보는겁니다. '아 이사람은 여기서 이렇게 했내. 하지만 이렇게 하면 어떻까?' 하면서 하나둘 비틀다 보면 전혀 다른... 
544,그리고 오늘이 바로 효윤이의 일되는 날이에요 ^-^ 맨날 아이디어 고갈에 ㅋㅋㅋㅋㅋ 이번엔 어떻게 찍어야 하나 고민이 많았죠. 근데 생각지도 않게 이웃동생 홍이가 촬영을 자처(?)해줬고 제가 또 그걸... 
545,초록잎은 책과 나를 감싸게 했죠..ㅎㅎㅎ (노래가사 인용해봤어요 &gt;_&lt;) 아무튼 아이랑 여름방학에 할 건 없고 뭐라도 유익한거 하나쯤 해주고싶은데 아이디어 고갈이신분들 차키 하나 들고 당장 롸잇나우... 
546,아이디어 고갈 ㅋㅋㅋㅋㅋ 예약문의 .. 카카오톡 kooji * 영업시간 :~: 문자나 전화예약문의는 영업시간내에 가능하며 혹여 시술중에는 문자난 카톡답변이 늦어질 수 있습니다 :)
547,일 포를 하시고 계시면 개의 글이면 일치 분량이니까 이시간이면 블로그 소재 고갈에서 회복하는 충분한 시간이 됩니다. 그리고 아이디어가 많이 생각나는 날은 많이 발행하지 마시고 개 정도는 예비로... 
548,"나만해도 지금 수학 시험 기둥 세워서 마킹하는 ~점대 학생들과 수업할 생각에 에너지, 아이디어 고갈이다. 어디서부터 어떻게, 무엇을 가르쳐야할지 계획하는 것이 참 힘들다. 백지라고 생각하고 수업을... "
549,궁금합니다. Blog fog(블로그 글 아이디어 고갈)가 두려운 저는 오늘도 열심히 보고 읽고 듣습니다. 즐겁게 읽어 주시기만 하면 됩니다! ^^ 오늘도 긴 글 읽어 주셔서 감사합니다. Written y Yuri
550,실제 요즘 스타일 디렉터들이 아이디어 고갈되면 저 때 가요프로나 TV프로 봄. 이유가 화장부터 머리 스타일까지 모든게 컬러도 다양하고 하도 틀이 없이 자기들 멋대로라; 아이디어가 막 샘... 
551,제목 아이디어 고갈.. 보통 최근에 제일 자주 듣는 노래 가사로 정하는데 요새 레전드 정신없이 지내고 있어서 노래도 잘 안 들음.. 블로그 작성하는 마침 지금 질주( addies) 듣고 있는데 딱 내 상황에 맞는... 
552,"에너지 고갈 등 환경 교통체증, 주차장 부족 등 교통 동네에 살면서 불편을 겪었던 문제의... 「년 성북구 청년 소셜벤처 혁신 경연대회」 여러분의 아이디어를 펼쳐보세요! ✅ 공모분야 지역사회... "
553,* 우리기업 산업에 도움이 될만한 아이디어가 있는가?? - 온라인 서점 방문하기 - 게시할 글에 아이디어가 떠오르지 않을때 필자가 가장많이 이용하는 방법은 온라인서점을 방문하는 것이다. 서점의 경영서적... 
554,"어바웃타임에서는 이렇게 와인 잔도 꾸밀 수 있는데 꾸미는 것도 재밌더라구요 (아이디어 고갈돼서 온갖 특수문자 폭발 ㅎㅎㅎㅎ,,) 칭구덜 다 타지에서 기차타고 달려왔고 다음날 다들 출근해야해서 분 초... "
555,"이제는 소재와 아이디어 고갈을 절실히 느낍니다. 아... 창작의 고통이여.. ㅠ ㅠ 책 안 써질 때에는... 여행도 다니고, 몇일이고 이렇게 다른 책들을 쌓아놓고 읽으며, 새로운 지식도 쌓고 있답니다. 뭐...급할 것... "
556,. 열심히 하고 싶게 만들어라 . 방법이나 스킬이 부족할 때 학습으로 채우라 . 선임자와 함께 활로를 찾아라 M 단위로 짤라 보기 . 어떤 부분을 제거(E) . 어떤 부분을 감소(R) . 어떤 부분을 증가하여(I)... 
557,부담 팍팍스 ㅡㅅㅡ 번역 그 까이꺼~ 손꾸락만 열심히 움직이면 되지만 출첵은 적당한 짤과 참신한 내용이 필요하단 말이에요 아이디어 고갈 상태인가... 여기서 포기해야 하나... 우어어어 (오열 중)... 
558,(아이디어 고갈...) 글자가 있는 가랜드는 따로 수정되지 않아요. 포토샵을 하면서 글을 함께 넣어서 저장해버렸네요 ㅋ 다른 문구를 넣고 싶은 분들을 위해 빈가랜드 하나를 어버이날파일에 함께 첨부하여... 
559,"상상력에 시동을 걸어 주는 개의 아이디어 모음! 상상력의 고갈이라는 장벽에 부딪힌 모든 독자들에게 상상력과 글쓰기 능력을 동시에 증진시킬 수 있는 비법을 소개하는 책입니다. 고속도로 광고판, 신문의... "
560,안녕하세요 대구 세천에 위치한 옷 만드는 공방 꾸메다가 입ㄴㅣ다 오늘 대구는 비가 왔다가 하루 종일 흐림으로 제 기분도 마치 그런 것 같아요 여러분은 에너지 가 고갈된 것 같고 아이디어 고갈일 때 어떻게... 
561,이작품은 추천하기는 어려운 작품인데 그저 아이디어 고갈된 늘그막 작가의 마지막 작품으로서 의미가 있을뿐이다. 장편으로 만들기 위해 꾸역 꾸역 분량만 늘려놨다.... 
562,"우리 기업, 산업에 도움이 될 만한 아이디어가 있는가? . 온라인 친구글에게 물어보고 싶은 질문이 있는가? 온라인 서점 방문하기 게시할 글에 대한 아이디어가 떠오르지 않을 때 필자는 가장 많이 이용하는... "
563,"엄마의 한정된 아이디어 고갈 해결책 자란다, 다채로운 서비스와 체험으로 새로운 경험하기 아이와 어릴 때부터 미술놀이를 꾸준히 했는데 의도했던 것과 다른 방향으로 가는 아이를 통제하려는 마음 때문에... "
564,아주 간만에 업데이트를 하네요 요즘 점점 액티비티 아이디어 고갈로 고생하고 있었답니다. 더이상 핀트레스가 부족하다고 느껴지신다면 인스타한번 찾아보세요.. 이거 신세계더라구요.. 상상도 못한 다양한... 
565,회사의 각 프로그램과 거래처 방문영업이 어느정도 성과가 있어 보람된다
566,"예전에 일, 일 때에는 작고 소소한 이벤트를 했었는데 점점 아이디어가 고갈되다 보니까 이제는 뭘하면 좋을까 싶더라고요. 그래서 다른 사람들은 여자친구 일 선물로 어떤 걸 준비하는지 궁금했어요.... "
567,"내가 아이디어 뱅크는 아니어도 어느 정도는 가지고 있다고 생각했는데,,어림도 없지 바로 소재고갈 이럴수가잌ㅆ나? 사실 쓸 얘기는 많은데 내가 귀찮아서 안 쓰는 거긴 함 가장 최근의 얘기를 해보자면 내가... "
568,"매년 비슷한 판형의 책 표지 수십 종을 디자인해야만 했던 존 골은 아이디어 고갈에 부딪힌 어느 날 밤, 기존 책 표지의 일부분을 잘라내어 가상의 책 표지를 콜라주했다. 우연히 시작한 이 작업은... "
569,여행 막바지에 이르니 촬영포즈 아이디어 고갈ㅋ 쓰던 양산도 치우기 귀찮아서 그냥 들고 찍음 (여보 이제 집에 갈 때가 된 것 같아) 판다익스프레스 Feat. 요거트랜드 요거트를 먹으러 간 건데 정신차리니... 
570,"아이디어 고갈.. 문센을 주회 가야하나 고민하던 찰나..ㅎ 채온이 생일이 같은 아윤이네와의 만남 카페에 갔는데 너무너무 즐거웠당 ! 아기들도 순하게 잘 있어주고, 수다 떠는 것도 즐겁구 !! 울 채온이는... "
571,"페북페이지서 재밌는 걸 하는 것 같길레 그래서 그렸습니다, 슥슥. 수채화 효과는 언제 써도 기분 좋아요."
572,&gt;ㅅ&lt; 저녁 메뉴 아이디어도 고갈되고 밥 할 힘이 없었다 ㅎㅎ 저녁식사 메뉴 애매할때는 외식이 정말 단비같은 존재다. 울산 반구동 갑진식당 -영업시간 : 매일 오전 시~ 오후 시 분 (오후 시~오후시... 
573,오히려 이미지가 훼손될까 싶어 멈추고 마무리 하였습니다~~(좀 귀찮은것도 있습니다 ㅋ) 현재 베이스 작업중 입니다. 아이디어 고갈로 좀 정적인 느낌의 디오라마 진행중 입니다~~~ 감사합니다!!
574,(쪽) 모든 아이디어가 좋다고 해서 좋은 일러스트레이션 이라고 할 수도 없고 누구나 다 이해할 수... 캐리커쳐라는 사람의 특징을 또 다른 아이디어로 접목시키는 과정은 재미있을 것 같다. 다만 잘 나온... 
575,"《휴먼 프런티어》는 과학, 기술, 산업, 경제, 정치, 문화 등 다양한 분야에서 과거와 같은 혁신적인 아이디어가 점점 고갈되는 이유를 심도 있게 파헤지고 아이디어의 본성이 어떻게 인류의 다음 단계를... "
576,"' '새로운 인연과 힘은,가는 곳마다 존재할까.' &quot;담!정신 차려!!&quot; &quot;이러다....죽는단말이야.,..&quot; &quot;너...익사할뻔했어...그걸 내가 구한건데...&quot; &quot;왜....&quot; &quot;눈을뜨지 않는거야....?&quot; ㅡ 월래 더 지을건데 아이디어고갈~"
577,확실히 시즌 초기에 비해서 시즌이 진행될수록 아이디어 고갈인 건지 실망스러운 에피소드들이 눈에 들어 온다. 그래도 나는 거의 대부분의 블랙 미러 에피소드를 재미나게 보아온 사람인데 이번 마지막... 
578,도와주시요~ 아이디어가 고갈되었소... 내 사례는 섭섭지 않게 드림세.. PENTAX 마케팅 아이디어 공모전 ... 참신하고 새로운 마케팅 아이디어를 모집합니다. 대상(팀):만원 최우수상(팀)... 
579,"우리의 이름과 날짜 .ㅎㅎ 허허 이런거 쓸때되면 아이디어 고갈이라 ..(머쓱타드) 뭔가 웃기당 ㅎㅋㅋ D- 희희 집중해서 쓰는 거 귀엽져 ,,&gt;&lt; 아주 고냥 부뉘기 체공 ! 수비드 항정살 , 항정살이랑 갈비살... "
580,"아이디어가 고갈되지 않으려면 많이 보고, 많이 듣고, 많이 생각해야 합니다. 책을 읽는 것을 통해 내가 살아보지 않았던 과거의 지혜를 배울 수 있고, 내가 잎으로 살아갈 인생의 방향을 배울 수 있습니다. 책을... "
581,Curator 큐레이터 콘텐츠를 제작하다보면(업로드를 하다 보면) 아이디어 고갈이 옵니다. 남들이 어떤 콘텐츠를 소비하는지 제대로 봐야만 하는 순간이 옵니다. 그리고 그걸 모아두고 내걸로 체화하는 시간을... 
582,쥐어짜내지고 있을 알앤디실 직원 여러분 힘내세요… 아이디어 고갈은 다메요. 다음에는 오레오 쿠키 들어있는 오레오 초코파이 내주세요.. 초코 + 초코 : 개맛있음 조합아닌가여 사진이 좀 어둡게 나왔다.... 
583,"(아이디어 고갈...) 역시, 교사는 꾸준히 연구하고 배워야하는 것 같습니다. 그래서 제가 주로 하는 활동들에 올 해는 알게 되는대로 추가추가하면서 온작품읽기를 풍성하게 하는 방법을 알아보려고 합니다.... "
584,"-&lt;STORY Time&gt; ‘법망을 교묘히 빠져 나간 스트립쇼 클럽’ 중에서 자극에 묻혀 사는데 왜 아이디어는 고갈되는 걸까요? 문제는 당신이 자극의 포화상태, 즉 뇌에 너무 많은 자극을 동시 다발적으로 받게 되어 뇌... "
585,대체 몰 원하는건데 새벽인데 웨안자 이날은 시 전에 자소서 제출하고 시에 스쿼시 갔다가 밤엔 지삿을 공부하는 야심한 계획을 세웠는데요 스쿼시는 개뿔 자소서 쓰다가 아이디어 고갈+초조 급하게 자소서... 
586,"누군가 #아이디어 고갈 때문에 괴로워 한다면, - 너무 고민만 하지 말고 부지런히 ‘조사’ 를 해보라고 충고해주고 싶다. - 위험에 민감하며 항상 안전판을 생각하는 조금 소심해 보이는 기업가 성공 확률... "
587,가공식품이 매우 빈약하고 품질이 아쉬운 이곳이라 메뉴 짜는데 아이디어 고갈로 머리가 힘들어서 그냥 몸이 힘들기로 겸심하고 판 벌임. 만들어 냉동해두니 당분간 도시락 반찬 궁할 때 매우 요긴하게 쓰일... 
588,"그렇게 아이디어 고갈되는 중, 이번 컨셉은 #공주생일파티 핑크핑크한 이쁜 애들 모아봄 ! 내 생일 때 받은 ㅋㅋ 공주 세트도 함께 ~ 핑크핑크 싫다고 했는데 내 마음대로 핑크핑크 ㅋㅋㅋㅋ #살딸생일파티... "
589,- YES : https:it.lytekYg - 알라딘 : https:it.lyRjJOo - 교보문고 : https:it.lyh - 인터파크 : https:it.lyFOU 아이디어가 고갈된 디자이너를 위한 책 : 타이포그래피... 
590,소재 고갈이라는 놈이 왔습니다. 평소에 조금씩 틈날때마다 합니다. 미리미리 소개를 적어놓습니다.... 아이디어가 떠오르긴 했는데 쓰기 뭐합니다. 그럴 때는 계속 이면지에 남아있습니다. . 제발 나를 이용해..... 
591,심지어 소재 중복이나 아이디어 고갈이 아직 없다는 점도 놀라운 수준입니다. 가벼운 마음으로 일상물같은 느낌으로 보기 좋습니다. 옴니버스식 구성은 아니고 내용이 죄다 이어집니다 ㅋㅋㅋㅋ 그래서... 
592,(제목 아이디어 고갈됨).. ㅎ 지혜생일 친구들을 만났다 회먹음 맛있긴 한데 넘 비싸^^ 이 날 지혜랑 청하 병마심 나 술 좀 는거 같아 .. (지혜는 아님ㅎㅋ내가델따줌) 다음날 민경이랑 세라랑 밥먹음 이 소식좌들... 
593,벌써 내일이 크리스마스네요ㅎㅎ 바빠서+아이디어 고갈로 준비한 게 없어 크리스마스 며칠 전에야 부랴부랴 준비했어요:) 숨은 새 찾기 산타 양말 속에 쏙! 원랜 양말.. 대바늘로 하려고 했지만 뜰 시간이... 
594,내가 그렇게 책임감 없는 건 아닌데 아이디어소재 고갈이 있었다. 일상에서 새로운 걸 찾으려니 없더라고. 무에서 유를 창출하는 건 언제나 힘든 일인 걸 유튜브 만들면서 느끼게 되었다. 그리고 음악... 
595,- YES : https:it.lyTnpLs - 알라딘 : https:it.lyacL - 교보문고 : https:it.lyWwDpM - 인터파크 : https:it.lyFJToRP 아이디어가 고갈된 디자이너를 위한 책 : 일러스트레이션... 
596,Photo y Bart LaRue 사진 출처 Unsplash 자아고갈? 이게 뭔 소리? 많은 돈을 지불하고 헬스클럽에 등록했는데... 그다음 분은 추려낸 아이디어를 더 구체화하면서 문제 해결의 실마리를 찾게 됩니다. 그런데 여기서... 
597,매년 선물을 주고 받는 친구가 보내준 실바니안 토끼다 &gt;&lt; 몇년쯤 주고 받으니 아이디어 고갈이라 이 친구랑은 그냥 서로 가지고 싶은 걸 말하고 있다 ㅋㅋ 근데 요번에는 도저히 떠오르는 게 없어서.. 왜 항상... 
598,"엄마의 저질체력과 아이디어 고갈로, 아이의 마지막 낮잠 시간에 찾아본 문화센터 우리 동네에는 가까운 대형마트가 없다. 걸어서 갈 수 있었던 롯데마트가 폐업하고 사라지고, 신도림 이마트홈플러스가... "
599,하이브리드 방식의 경우 게임 스튜디오들은 새로운 광고 소재에 관한 아이디어가 고갈되는 지점에 다다를 가능성이 높다.이 경우 이미 보유하고 있는 내부 팀과 더불어 외부에서 영감을 찾는 것이 도움이 될... 
600,하면서 그린 특수부대 컨셉 남캐 카드텍... 구상만 해봤다고합니닼ㅋㅋㅋㅋㅋㅋㅋㅇ&lt;&lt; 지금 두명 그렸는데 벌써 아이디어 고갈...ㅋㅋㅋㅋ 야매이지만 재밌었으니 되었다...ㅇ&lt;&lt;
601,ㅋㅋㅋㅋ다들 아이디어 고갈? 어차피 그주에 회를 번이나 먹어서 오마카세 별로였기에 그냥 복어 코스요리 먹으러가씀 ㅋㅋ 오마카세 한번 데이고 나니 어차피 가기도 싫고 쩝 회사송년회로 가게 된... 
602,그리고 요새 빠진 건 네일아트랑 마인크래프트(always) 인데 둘다 요새 아이디어 고갈나서 창작의 고통에 시달리는중임 하고는싶은데 아이디어가 없어...!! 이번주껀 좀 알차게 써봄 그럼이만
603,"이게 어떤 한 주제로 글을 발행하는 것도 어렵지만, 그걸 하루에 몇 개씩, 그것도 매일같이...한달 정도면 아이디어가 고갈될 수도 있어서....참 쉽지 않은 작업이다. 그런데 대부분이 다작을 한다. 그리고 루틴... "
604,아이디어 고갈이다. 점점 산으로 간다... 시장조사가 필요하겠다... 쉽게 끝날 줄 알았던 로고 작업이 생각보다... 더 시간이 걸릴것같다. 오늘은 일단 여기까지 ㅠㅠ
605,이제는 더이상 숨길 수 없어요~ 사랑 하고 있어~ 제목 아이디어 고갈에 고민하려던 차에 갑자기 생각난 노래 오랜만에 들어볼게요 롤러코스터 - 숨길 수 없어요 지난 주! 드디어 수영 하러 갔습니당 수영가방을... 
606,뭔가 특별한 문구를 넣고싶었는데 시간이 촉박해서 아이디어 고갈로 넣지는 못했지만 요거 계획하시는 분들은 문구변경이 가능하니 재미나게 넣어보시면 좋을것같아요 :) 그렇게 완성하고나서 출력시작을... 
607,야외에서 촬영해서 그런지 앉거나 기댈수도 없고 시급이오천원인상되었으니 더욱노-오력 하는모습을 보여줘야하는데
608,집밥의 아이디어 고갈 위기에 때때로 구원받으시리라 ... 믿습니다. ^^ 골뱅이 쫄면을 아침부터 만들었으나 아무리 먹어도 질리지가 않는 골뱅이 쫄면의 중독은 밥에 지치신 당신의 야식에도 ^^ 마리안 테이블... 
609,저도 도시락 싼지 주 되었네요~ 물론 아이디어는 고갈되어 버렸습니다 흑흑 급식 먹고 싶다고 난리도 아니구여 ㅋㅋㅋ 아침을 잘 먹고 가고 학교 간식도 먹기 시작하면서 점심 먹는 양이 줄었어요! 월 살... 
610,"새로운 생각에 메말려 있다면 책, 미술, 음악 등의 예술적 가치를 지닌 작품을 가까이하는 것이 도움이 될 것 같습니다. © angelaaileyy, 출처 Unsplash #새로운아이디어 #아이디어고갈 #생각의깊이 #예술작품이해 #사유"
611,http:www.pictureook-illust.comsan_krcommunity__d.asp?idx=&amp;oardno=
612,"그런데 문제는 아이디어 고갈입니다. 환갑 때 잔치부터 해서 해외 크루즈 여행, 성지 순례 여행, 한국의 집에서 품격 있는 식사 등등 다 해보았기 때문입니다. 뭔가 참신한 무엇이 없을까 하고 남편과 함께... "
613,달나라를 만들어봤습니다&quot; 오리님 &quot;타오바오에서 구매한 우표스티커 써봤어요~&quot; 달콤커피우유님 &quot;아이디어 고갈로 원래 하던 스타일로 달을 소재로 다꾸해봤습니다.&quot; 횬이님 &quot;귀여운 죠아냥들의 달나라... 
614,더이상의 아이디어가 고갈인 상태일 것으로 크리스마스선물로 뭔가 마음을 전하고 싶지만 감동을 주기엔 엄청난 검색과 아이디어를 동원하고 있을 것 같은데요. 오늘은 와이프 프리스마스 선물로 정말 괜찮은... 
615,아이 반찬으로 좋은 바르밀 무항생제 함박스테이크 아이들 반찬은 늘 고민이지만 방학이라 끼를 다 집에서 챙겨야하다보니 그야말로 아이디어 고갈상태. 아이들 반찬으로 먹이려고 함박스테이크를 구입했다.... 
616,아무도 신청을하지 않는다....
617,그녀의 미션이 시작되었지요 &quot;고갈직전의 아이디어에 영감을 불어넣을 이웃님들의 아이디어를 들려주세요&quot; 초심으로 돌아가 다시 정진하고 싶은 마음자리가 예쁜 그녀를 위해 아이디어 공모에 적극적으로... 
618,대구레터링케이크 [버니비케이크] 일 기념 케이크 다시봐도 짱 귀엽다 이뽀로 아이디어 고갈상태로 인해 사장님께 아주 투박하게 [원피치❤이뽀로  DAY]라고 멘트 말씀드렸는데 센스있게 만들어주셨다ㅋ... 
619,(아는 분들은 아실 거예여....) 여러 예시 페이지를 좀 보여드리고 싶었는데 아이디어 고갈 + 체력 고갈로 급하게 마지막 페이지를 들이대봅니다 이상이에요! 잘 활용하셔서 멋진 발표 하시길 바랄게요 글꼴... 
